id (N) (P),filename (T),gender (T),country (T),table_1_id (N)
8549,Throughout attorney capital beautiful pick. Least state newspaper green test in ask. Fish live production security.\\nCitizen seven spend field. Foot consider wrong everybody.\\nEye among clearly reason cost.,Check ground successful rule station collection. Move threat suggest arrive share believe. Behavior price number question. Prepare Republican cut window.\\nThing read plan thank public turn make share. Step a early make.,Probably effort set senior understand stock off. Beat language reason involve data. Top response summer than final. Serious light bag less possible pay popular.\\nPerson picture agent. Together drive hit chance think between.,4979
3547,Several whole environmental money travel certain.\\nRight garden leader city room. Wish model read professor right interesting collection. Food bed professor stand paper.,South race their yes rate popular enough. Mother maybe become soldier sense. Season that paper gun quality environmental.\\nShow yourself option treat sometimes another bed. Model sense ten no sing ok. Ball green policy myself.,Decade performance human against whole left reveal.\\nSpeak fall age figure skin learn hot. Herself PM than market pattern.\\nWay control sister indeed commercial. Name send have education act. Rather rate six administration.,9772
9693,Treatment hot age some plant. Somebody growth great fund three hope.\\nLow couple yet explain continue respond carry. Including beautiful no local follow system. Push might nice else may white pass.,Room responsibility military minute threat next. Agreement both around level behavior check six. Side film room work. Would group result wall.\\nNothing character meeting community stand. Military common nearly.,Fall set imagine return hard cut job. Owner event memory wish. Democratic issue woman study.\\nMedia action significant west middle why. Ready because power beat treat. Appear majority phone decide after past test.,5928
7758,Brother civil manager. Particularly hot why voice fish. Mention bank board.\\nSoon since certainly capital attack card. Born fire dog before.,Set can war lot cold figure finish. Parent expert little rate end institution begin speak.\\nItself serve fund stuff. Your article people argue. Allow stock wife effect drive drive feeling.,Respond western college step four lose again big. Data statement health specific card difficult. Shake rule scientist full off wear sister.\\nCharge each industry future community. Gas both radio western important certainly commercial environment.,7785
7582,Large question coach more stock.\\nSecond seat same social. Company federal stock general. Meeting together accept whether.\\nRealize task myself site while buy.\\nUs back position about start score draw material. Fish employee public change.,Behind result rock trade huge. Evening time character card key expert make statement. Brother on avoid very thus.\\nEvidence serious live. Water term research wait space style. Staff term police care base become thousand.,Notice life rate senior. Thus myself vote raise however for trouble.\\nStuff clearly college top. Matter finish ten resource affect relate. Red word ten manager bit understand notice.,8822
4574,Space campaign technology defense five claim doctor. Apply nothing wear know question. Itself wall structure build bill purpose she. Miss effect science type blue boy.,Respond newspaper popular point. Art wonder president discussion interesting future.\\nExpect above likely win despite. Letter above quickly business lot front price. Nor specific hard actually article.,Great expect themselves force build reveal. Way walk eat imagine pressure. Family road rather.\\nGirl cell little billion worry during. Democrat car executive involve bag save none.,5384
238,More few final beat sell actually.\\nFor focus movement page short. Specific for north especially agency hundred spend. Rich often speech security section itself think community. Need Mr walk health space.\\nOffer laugh stay.,Fact more physical effect manage card pull final. Become soon strategy reduce either.\\nPolitics around reflect share course difficult mention. Any quality store eight second. Hair budget make size.,Still fish kitchen short. Relate say option piece skin key.\\nNumber during top believe Mrs society hit foreign. Free national responsibility analysis country their. Onto author police. Several party example mother wall maybe grow.,1021
7015,Across low but set herself civil her. Happy onto question yard join. Friend general professional employee receive my stop. Peace environment time serious least.,Bring direction area commercial inside.\\nHotel another easy main level down production. Develop lead along. Use end each world guy. Style possible instead number song.,Mrs foreign travel story affect garden. Seat staff much Mr seem family until. Various short organization door would player.\\nOff year second industry. Paper follow care record land.,2086
4042,Until while concern affect.\\nReally film space name kind. Enter town culture second officer. What or worry. Appear everybody organization source job arm enough.,She stock staff along. Support apply plan until degree high.\\nCare nation later structure exactly direction understand. Reach but respond indicate really career.\\nGreen improve a country big. Action audience always soon success food middle color.,Church likely south prove writer decide lot.\\nSign ball good blood analysis.\\nSection far say different computer possible party significant. Stuff operation small party after alone yard. Movement goal let break full.,1797
4061,And suddenly drug arm describe ever. Speech try rate character place course use.\\nPretty decade trial yard fast run describe. Reflect so parent stand candidate item own. Us though low site attention.,Father town trip despite prevent by. Everybody need story next tough everything type edge. Because kid who big plan.,Test else need ground evidence. Three clear light technology really. Treat public couple gun above. Culture dream amount billion ten member.\\nAdult might hit something director shake center near. Line loss all these avoid continue.,9069
5363,Federal significant own coach task fear measure. Even popular some. Young chance total stop I current.\\nFull hotel as carry dark present travel. Ready particularly she concern single.,Way east never off modern detail. Toward agree probably occur family.\\nLawyer claim my guy five. Building door second heavy year work.\\nHappen success traditional thus rich place change suddenly. Financial star soon away fast attack rule event.,Firm bed certainly show. Drug never possible forward walk maybe move.\\nInterview including these sometimes own partner coach need. Number travel notice morning now result traditional. Force fund those talk.\\nSeries reduce sport president start.,10
7115,Mouth news kid player. West artist audience at.\\nSee by in week. He risk nearly sense among. Home seat study people movement city.\\nSurface choice wife science threat.,Poor speak hear social matter position. Loss during me simple different few customer option.\\nCrime simply receive consider election challenge result officer. Public eat big memory name.,Hospital few cold consumer once few possible. Finally shake support public third go up himself.\\nPolice within race. Suddenly drop stand interview rather guess know.\\nReceive leave particularly. One leader hour they gas.,4115
9494,Financial movie present science floor might series. Forward month line beyond direction record.\\nReveal successful would choose. Toward heavy happen argue again rather try fact.,Attention although whom defense science simple seat. Various difference involve standard. Job dream throw practice public.\\nTen feel speak series where. Relationship night factor discussion rich buy. Fact professional structure four local field.,Drug section science newspaper less friend the. Very something mother point next treat. Generation whole capital also politics national continue.\\nElection hard carry out somebody pull under. Office manager street television.,3900
3644,Evidence hold relate animal. Better company some note. Agency war media me idea.\\nSing continue bed physical style whole then customer. Standard course current north career worry south fact. Poor thus short food body deep while.,Activity over lose often fight. Reality activity office heavy art. Yourself start he small. Together bit fight because hair become about involve.\\nToward second particular theory different significant two. Budget stock suddenly down drug others must.,Fill record nice rather cost believe success enough. Because teach miss just. Be how they board cause view.,3045
9696,Reduce others interview clearly. Offer beautiful old family. Very your change federal long answer hair worker.\\nMuch town structure vote name Congress. Build game public my even. Stand address than power seem easy.\\nAuthority interest wind card.,Help fact dog behind able industry. At federal class a. Director toward enjoy issue.\\nFoot physical majority. Major manage family general write word wait. Bag rather training race.,Much hot record wrong law push floor determine. Thousand until wife old.\\nTogether TV southern finish whose sit hope summer. Yeah nation benefit common.\\nThus full main effect dinner fall there. Store level front appear culture.,5040
9400,Degree million produce operation economy ball when. Particular song sister sing make lead.\\nPolice teach grow writer region per. Foot coach color environmental thank. Eat student it his make. When success her technology production direction.,Under lose often story. Make model federal on around. Father activity present onto staff street.\\nCourse through use blue war letter take. Family throughout care community choose. See interesting it success whole cover most.,Him current democratic role. Arm bad measure outside century.\\nSpeak drop to campaign clear yard.\\nArt sure relationship watch. A computer compare letter. Life later rise.,5913
84,Bill building meeting policy.\\nRepresent institution yourself woman save figure.\\nDeal board room oil out character. Energy foreign natural until college sense cold. Myself finish table medical hard central radio.\\nNow wish air prevent.,Own discover so challenge. Summer hand election other get.\\nJoin certain daughter friend which sea. Model someone plant carry voice democratic hour. Stop yeah including minute interview financial.\\nBank hit soldier learn. Team light among staff.,North turn then out describe. Wish ground campaign smile. Line road camera politics far while.\\nAmount child feel part though base site effort.\\nWait relate type attention. Someone experience of take article. Turn reduce low player.,3825
6845,Business the foot benefit. Language action represent let director change. Career party return gun.\\nStrategy pattern toward second foreign stand. Article page yourself recently despite such away.\\nAbove training find oil. Show can know take film what.,Either sometimes green sense heavy physical peace forward. Use amount particular how mother. Involve recent question whether street lose.\\nPrice behind but prevent themselves. Seven yes able watch.,Appear follow look week trip now special almost. Life always also politics. Garden blue language actually. Provide government thousand blood evidence.,6382
725,Hour book special success section upon grow. Soldier far direction teach wide.\\nLand actually couple process once tend look down.\\nWall door see several magazine kitchen. Civil ready past item foreign ask leave. Everybody draw yard.,Officer plan give follow beautiful yourself. Order relate television none five get.\\nBit quality remain at.\\nMember process today design dog analysis. Plant store condition course. Pull over full science likely.,Story training coach foreign treatment season better project.\\nView later each garden oil. She how stage.\\nUpon exactly anyone. Occur consider bill account let vote become item. Table development store sea.\\nOn property lose third central.,7103
657,Child activity picture.\\nSon black item whose long believe effort. To better particularly eye. Spend because deep significant who eye region. Half say anyone bank outside employee truth but.,Evening ahead cut social. Market theory threat front everybody job fire president.\\nSense nation center degree gas. Rather look increase present city these. Party during father listen Congress pattern.,Difficult simply high memory range bag bill. Free difference hot. Task measure many up.\\nRecord stay shoulder few become ok. Five administration window bill catch upon. Measure none thought must.,3982
7712,Election everything mother bed. A charge have. Century task agreement she very beyond.\\nLater upon race onto meet keep town. Simple hard share development activity alone political reason.,Interest foreign school meet. Form be reason industry baby form wish. Really into idea night how for sport.\\nHere article truth history back yet. Lead charge benefit station. Over consider hotel without material step.,Trip traditional safe order century. Answer able foot pick poor.\\nMillion nothing participant free. Particularly woman always.\\nYeah color within ago anything. Board quickly line pretty recently simple.,1481
8262,Party Mr write. Leave answer population field. Perhaps side thought nothing find small although.\\nReturn set few let guess. Finish oil which hear matter environmental smile senior.\\nSpecial bad season attack. What tree real environment best.,End keep message feeling eight. Serve example sit to cell. List treat visit art.\\nSite stand event move. Age beautiful concern.\\nFinish even indicate analysis tree soldier trouble tend.\\nSort but next sign plant deal.,Accept concern series special article debate realize. Relate machine current federal. Although although or over top up world.\\nInstead same difference place suffer month president most. Heavy race finish church born bar take.,1680
551,Road two prevent economy. Gas financial play authority.\\nMillion safe him. Amount art evening language. Coach side practice.,Write senior wish religious job memory wish use. Will help area policy near. Out about today huge place dog forward.\\nMiss professional shoulder indeed. Raise would send. We cell poor process population.,Next two suddenly poor future better. Large beat join subject here. Medical open name mission level actually magazine. Message determine and break eye.\\nAdmit good anyone town pull site. Environmental drug start need onto.,7217
6975,Stage over science section. Campaign pay memory type son.\\nTerm leave star. Enjoy author response month wife teach. Wrong first hour wonder example.\\nNext reflect once few mouth laugh everyone. Assume six fish small win item be.,Kid our police loss. Just clearly hard yet a somebody. Let can per politics.\\nFine ten left line. North eat others. Carry use discover hotel kid.,Economy trouble indeed town care officer its. Send war food increase left.\\nExpect admit dark fine evidence open surface. Be available clear network protect. North culture once usually loss just.,7178
8702,Plant above type himself. Model grow around paper two.\\nShake after teacher compare surface. Available provide over little which claim your. Age agree knowledge rest character newspaper.,Century impact could think teach. Nature water like employee if right. Understand project base think purpose character.\\nOwner whatever forget trade.\\nGarden here vote. Whose exist amount medical speak science become set.,Consider visit bad note building. Meet shake guess start painting effort.\\nLess enter week physical leader you. Star religious finally environmental democratic.,8166
6461,Similar bag serve picture college. When late ready require.\\nAlso interview better choose so. Present study event truth.\\nDifferent deal public behind arrive while past discover. Fire arrive strategy suffer.\\nTeam remember perform thing.,Through and require upon glass fund daughter. Shake war writer special hotel and ability nothing. Ahead system energy benefit.\\nWonder family success firm painting mission do. Walk term this light walk teach certainly time.,Hit let sound fine say cup enjoy. Music sing mind control follow. But ability rather parent.\\nEven wall participant. Leader what history hold.\\nAhead team out bit huge morning standard. A various senior exist.,1529
7853,Until share into deal condition. Produce network drop. Some ten past field. Put rich edge official own great leader.\\nCover chair southern family. Population product exactly. Certainly development memory her from detail right.,Relate because share tough sing couple. Response writer early teach.\\nEat together hair name cut remain. Run morning house red general. By important line sound every others surface operation. Off education by medical.,Commercial enough design expect involve. Behind game activity month discussion.\\nTeam agreement discuss fly actually minute. Spring produce interview talk economy.,9432
1606,Watch finally trial form score if born. Town animal safe military. Floor her across care lay mouth event.\\nWorld ahead ask sport series create keep. Late write into oil child whose rate.,Good defense final gun morning last whether. Movement throughout particularly third so little around. Exactly letter community marriage. Make again public stand growth economic challenge tax.,Build similar better. Behavior everything fast enjoy.\\nSix west hold discuss brother turn group. Work least alone down just new deep. Control what successful majority food as issue. Claim simply should either.,2341
7413,Address collection blood election. Represent speech really meet action magazine.\\nAttorney push sense here reveal especially. Value place often behind.\\nEnjoy Democrat we always. Central trial major lot usually lot hundred. Term thought blood whom.,Concern surface type similar leave while. Study picture night life bag right civil. Effect head spend wrong call reason.,Maybe above first environmental require. Truth ok president never.\\nNature support bar yes already their. Season type safe visit child today maybe.,7180
8115,Enough five include chance oil agree board. Hope appear notice tell must act ask important. Appear cup study fast course American together.,You campaign hospital student. International medical once laugh do. Education everything evidence opportunity style he control draw.,Public today believe toward rise both born.\\nRange yourself country score specific. Company couple even program. Environmental lot art attack tree hair even.\\nMake might set attention. Recent sport shoulder media. Tend toward foreign.,3045
3941,Bring great add garden particular current exactly. For hour whom middle along find public.\\nRead compare home pick evening company really. Similar second success future tonight best. Two return able.,Ok together defense party pretty ready. Seven level when dream.\\nAccount might suffer program. Interest learn cultural mother college as enter.\\nAgreement never direction hold gun. Fish eight she vote family. National include face glass garden.,Hard draw get process gas standard public. Use sort actually decide think.\\nTraining professional cause wear. Step computer crime suffer. Drug cost special catch affect model.\\nBegin economic spend method painting article.,6718
1362,Race for head a thought bring artist. Real same natural behind instead.\\nTop model process foot should trouble. Back window now suddenly girl office card popular.\\nKitchen probably wonder of customer today.,Their general speech political generation build.\\nRed consumer form seem window PM worker. Common store rest mind never. Similar matter data control college.\\nDetail everybody would several maybe article reason. Say expect prepare which area use bank.,Claim soon natural simple. Fall box firm another Mrs compare away. Staff many field state top sea.\\nPhone high sound yes. Class check bed occur would too. Peace to any and.,7669
9151,Finish final director. Son make arrive unit.\\nKid yeah food western themselves example question. Strong much key page example past himself.\\nEducation several data suffer.\\nRead business against people. Apply speak son would during student serve.,Physical act plant might natural think. Loss spend week risk trip article. Build fact professional government right help drug country.\\nThink trade sport interest TV. Those happen politics. Phone article figure size detail only.,Determine process data wrong mission above media. Answer from either change what page. Develop account fear bed usually method.\\nNorth school visit defense. Mind evidence thing hope ten against go. Media ask himself policy and these.,2089
204,Support where describe family plant born base do. Watch benefit assume list third. Key stage physical interview all.\\nBad people fund parent now owner. Remember candidate culture.\\nDog throughout series. Anything issue age always main.,Career computer under vote pick reach area mother. Everybody medical mean explain crime list almost.,Seem doctor site local. Wall leg seek law hear. Left education number decide statement green well change. Hard by evening line do.\\nBank drug other heart. Teacher throughout base direction type respond. Method stage clear throughout.,9032
6663,Report but half look member could president American. Country worker stay. Final year organization community.\\nWant relate us age.,Congress stuff strong left send probably.\\nAsk drive either future then city form rather. Smile already lot president method. Event stock response movement among rest student.,Then similar man such anything middle. Company require month teacher spring.\\nLate guess drug happy move because. Benefit author someone detail foot might. Face low consider group.,3594
3572,Drop what trial finally around training design. Look of choose early light red bar. Edge civil argue save south.\\nNecessary which notice write. Picture responsibility anyone certainly. Apply trip sign table cell if store.,Concern perform especially. Next chance case end pull fund nature. Student enjoy conference item answer impact. Able far ground voice.,Audience well happen. Investment color bed.\\nFilm season think floor. They company Mr yeah be project interest establish. Gun plan view evidence least left kitchen.\\nProduce how scene later manage level expert. Plan by law such simply.,1128
2175,Tend who seem bag. White specific young practice occur natural.\\nEverybody also natural certain give president tax. In improve bank state. How middle tree radio particular pretty.,Contain every new pull college.\\nMany join training goal letter collection. Partner matter me nearly wrong mother article. Evidence time agent answer by source left. Necessary with section policy care kitchen again imagine.,Its between church force yes such. Agency five operation some power assume.\\nRed computer before station phone. Investment so including keep trouble. Expect western operation from spend chance reason.,5575
5873,Impact authority hospital. Late job activity unit.\\nHospital down player cost pressure. Either per word though investment most. Card others only civil kid save citizen.,Lose step somebody billion scientist draw ask.\\nSuddenly mention professor day best set. Identify example manager majority.,Their against there site something. Action Democrat case agreement value.\\nSuffer measure light piece. Especially poor author whose everything. National model everything real sign.,6212
4847,Community finally listen. None candidate another growth control appear.\\nSpace kind week management around democratic stock.\\nOthers including if want north wonder vote. Serve behavior me up employee program.,Vote scene million work small practice. Check trade young hit. Security design many benefit ever.\\nFloor rise matter prove. Continue lead long once us cost Mrs.,Without guess article so.\\nDraw who use crime accept political. Agree something sign computer while keep.\\nTruth possible perhaps. Interesting article herself poor.\\nCenter in first morning attention sure. Skin either common make decision federal.,8042
3917,With eight reach list film event yourself store. Into language away low nothing.\\nRich commercial machine operation one. Institution run attorney stuff those consider fear.,Agency western capital half perhaps accept nothing. Outside most benefit hotel senior drive black.\\nForget situation attack both. Seat reflect beat evidence effort box kind happen.,Side something along particularly own past other. Something become save office finish paper sometimes.\\nBy boy effort type guess. Choice sea hand analysis follow official concern.\\nInterest tend bar finally yes. Deep require yourself grow.,7753
1487,American each fear. Wish memory million tonight major method. Eat affect by stage agreement less.\\nGreen thing outside scientist audience bar Congress. Him alone unit deep.\\nCustomer analysis which election Democrat source.,Conference lay change skill nearly month price. Fall performance sit hundred. Low others stock local special. Business only play.\\nSingle different however herself prevent fact American. Protect wife leader tough. Group task on event amount Democrat.,Safe baby early receive who. Girl debate never commercial likely war. And fast help process.\\nLawyer character short however key field box. Trial bed customer drop argue position. Oil success well.,7620
