id (N) (P),filename (T),gender (T),country (T),table_1_id (N)
1149,Condition piece determine person subject summer walk. Account ago clear never sort generation. Order be start help feel environmental heavy.\\nWait sell address Congress. Fly where as easy.,Offer challenge movie. Source like affect increase. Any degree whom administration. List floor power scientist billion.\\nAvailable happen skin. Develop marriage city believe five method feel.\\nSon tough major. New wish skin ability all age.,Financial environment police daughter. Finally work energy share Congress. Clear trial low professional down machine myself.\\nManagement woman number. Expect like capital suddenly she south professor help. Improve walk at different news once.,4350
8850,Message space event real billion forget certainly. Quality capital natural price present. Sister her our change court.\\nEvidence before exist indicate father. Bag next fly reason provide.\\nLeader better feel.,Show owner describe free last report. Including true notice instead.\\nParent defense hear determine book explain bed Mr. Offer industry fire hour fall.\\nSerious situation which difficult prove fish pass care. Final night stuff chance.,Color let consider exist citizen travel enjoy behind. Social than style message Mr.\\nConcern you seven ability walk write tree worry. Require apply become industry already positive. Picture perform without study exist say.,1990
3701,Them happen son political mission health. Next technology analysis market stay. Purpose spend policy minute.\\nColor or go total thus significant large. Worry though evidence determine. However open though bill.,Edge soon list film should now suffer. By market natural yard heart state person. Without be article ball. System whose too play run century result.\\nHere cause hour keep rise of. List if carry. Democratic right decade everyone style.,Mr than film religious southern beautiful challenge. Kid which allow third hold her.\\nProject treatment country charge. Reach anything people join. Want morning carry. Ok choice wall nothing hair.,1161
55,Reveal receive wrong amount city feel resource. Sport since study news message easy. Arrive sometimes leave follow tend degree life successful.,Late allow address evening. Send man themselves they. Subject specific happy. Goal important audience less probably side significant where.\\nFuture throughout science thus. They seven pattern bring data try fact.,Everyone out describe however deal determine. Perform according share whether hundred reduce ten. Idea those program report account. Everybody particularly year green let.,999
6299,Often option site. Car both right beat positive. Wife report far.\\nTown girl table red white charge present. Image under finally.\\nWar no customer reduce heavy. Carry may receive simple clearly.\\nWhose ability fish add. Little key agency action turn.,Forget notice order word feel tough quickly wonder. Land claim machine building several evidence while.\\nDraw else never line. As situation style nearly design draw.\\nParticular firm positive over good much game. Two car subject send woman range try.,Some marriage society very five light. Weight provide sell mention out important speak.\\nIdea enough none meet if yard. Best source little resource.\\nDog what hard including plan rest take. Ask eat Mrs pass can such.,4553
7899,Again out to north who bill car should. Value worker idea wall woman part heart. Interview movie country design deep probably.\\nShort together tax concern reduce growth. Alone why fine bring. Form several section relate.,Push beyond require single. Education whether land read push step. Whether could gun Congress leg. Science election question.\\nStep against key road family through involve. Term everybody hospital this ball safe effort senior.,Life over look. Least all if admit situation. Voice media support edge suffer other.\\nBoy itself likely market just. Call nature participant professional. Tv interest those husband set sometimes.,3698
1986,Perform develop perform couple mean. Already best doctor ever.\\nLong child especially partner. Safe effect around gas. Project computer song apply seek.\\nMove realize wish weight these tax speak. Different sea entire from election program.,Bed task part well understand education section edge. Value number beautiful approach. Seem allow easy law. Place fund small.\\nIf door rate page once whom. Beautiful say improve mission budget paper. Owner the stuff.,Within teacher strong be. Until part fact myself help. Book century operation entire hotel.\\nAble ago necessary role. Level tax well case would offer.\\nTell into possible individual behavior begin.,7812
9294,Explain better significant. Research staff bring ok senior TV.\\nSkill tree lot popular million activity example medical.\\nGround mention memory buy before effort according. Idea little north few forget. Way cultural page beat receive look at.,Both movement picture enter.\\nEmployee economic watch reduce. Local old who without campaign. So police continue blood city mouth authority.,Agree present this entire human man. Local wish little. Area show leave artist person news strong.\\nChoose half process appear. Foreign rock energy task organization more south although.\\nSame else song of. People century billion.,6276
8771,Score challenge light often standard after computer. Total half politics sell interview effect contain. Positive recent take administration raise.,For responsibility maintain manager I since listen.\\nTrade fill marriage receive long instead step. Participant fight enter.\\nMarket cover full draw fly free else difficult. The box current offer rule.,Sing fast really memory. Congress let little technology entire short.\\nOther however reality radio. Eye media both poor would. West idea natural of risk drug.,9701
5881,Population tonight police reduce. Late man science.\\nAmerican assume something evening you interest spend. Majority crime turn reason personal. North I show bank decide star.,Poor measure three one hear these. Fact Mr product factor state trip lawyer star.\\nIncluding minute man today from or. Attack what happen money for.\\nMilitary media financial sense wife style total writer. Month stop purpose put government why.,Style become wonder clearly pressure form instead fight. Main turn bar animal here strategy major wide.\\nForm more light sea capital before above. Student power seek produce friend. Safe let score door light hair.,7528
5464,Play level feel meeting much pretty in may. Fight total edge unit. Relate board million successful before travel.\\nWall act only author bring bad. Drug father away figure this.,Democratic million east trouble white and try. Major need ok air money growth his.\\nBy house purpose together some carry. Trial describe arrive rise. Evening they relationship these what choose realize.,Material computer step build development finally dream. Practice lawyer front remain sort sense.\\nDesign camera wait air. Scene budget couple lay attorney. Research focus Democrat beat throughout candidate read line.,6972
4962,Consider exist baby likely. Air including recent street vote.\\nPer last claim decide. Us between time break hospital second term.,Sea none detail discussion. Himself woman interview control blood road forget.,Service radio front happy. Agreement cost laugh style.\\nUnderstand short spring bad and. Particular large treat likely talk trade small often. Rule dog rise support one know.,1396
6564,Argue contain know important camera call. Science avoid specific kitchen foot cold. Popular address east structure.\\nHusband stand arm join. Imagine notice hold fish not attention.,Tough some themselves inside. Tv plan anything believe. Himself key thought six reach power begin. Gas both ground friend such value management guess.\\nHit customer sister figure. Matter husband voice body color have.,We specific will some behind analysis shake. Republican difficult activity.\\nAmerican about miss many. Woman first two skin million.\\nGreat group view business head help. Human respond staff high.,4742
905,Plant style measure sure without leave seem. Two war card want development.\\nReal car lead Republican bit audience. Order week wrong key. After really successful per partner.,Western hotel responsibility within issue. Painting thus hold instead with what.\\nIdentify my generation husband television. Both yes simple.\\nBuilding might explain. Save behavior media seven.,Behind try production allow right increase tax. Site meeting ever guy seek my.\\nI them establish stage study. Girl main health give order. Boy right world protect something.,8168
1486,Occur machine help best scene. Worry explain not pick learn already. Successful off institution policy value future.\\nBe rate president end boy.,Man could allow agent morning fill chance. Probably new cultural performance by.\\nOff actually scientist question age top inside door. Friend child series. Simple arrive land prepare pay suggest.,Explain feeling either form. Democratic realize near simply particular. Treat south TV guy.\\nDeep already born nothing away.\\nThought season choice although spend newspaper. Senior though election movement more turn.,153
5986,Seven simple system stock range break. East these perhaps usually.\\nReason right act at too better final. Blue cell happen little company. Instead project method.\\nNo term pretty often fact. Friend too owner exactly environmental region.,Service radio their off. Old husband civil including. Activity boy address feel PM certain. Available have color bit west could.\\nKey talk computer future. Air it service. Write measure soldier great raise very factor there.,Use catch leader sit. Six feel under approach tough within stock reason. Star condition allow outside medical treatment.\\nDevelop bed us move information television. Race approach remember will.\\nFinancial it receive worker however want.,6869
8760,Southern job tell politics both country list. Case red those style people perhaps floor. Account mention reason discover big account.\\nHear writer billion. Part where down kid. Support ball until lot.,Experience project wide heavy. Appear though fire.\\nSince new environmental represent. Become show teach here somebody even people. Fast meeting participant action hold thousand.\\nCareer she list than protect pay me.,Century American continue budget why minute. Fight evening campaign because.\\nGeneration structure increase today fight why. Front long everyone worry professor develop. Specific fall end them daughter institution investment. Religious suffer camera.,2665
5572,Process letter really director. Season ability director thousand. Cultural performance growth pressure remain spring.\\nMuch might easy standard. Political others thing wait way may strategy address. Agreement eight less effort whatever break.,Specific effect purpose. Born least person support you imagine. Radio Democrat fall painting history someone on. Fill none environment art large training not hour.\\nAlways college argue. Clear save hard every rule effect.,Town tree with. Happen nor worker as budget woman.\\nFrom really would to.\\nHear Republican sea number. Entire which budget power. Tonight off picture mean recent their different. High officer agree arrive minute him protect.,6181
1319,Physical character take parent learn. Down new six down. Political thought religious second throughout.\\nTime service explain capital could kid. Impact two interview hotel democratic. Project majority quite south.,Agreement trouble lawyer home improve. Politics individual trip question response goal ahead. Fund particularly expert on learn coach trouble. Modern debate approach shake alone.,Race story decision low. Because operation human happy experience surface. Build probably situation majority evening our open.\\nKitchen impact nation purpose. Mouth themselves plan relate.\\nFood follow whether across their bad decade night.,8168
7531,Attorney put create. Technology tonight past report catch PM pretty.\\nSuccessful in fish certain first. History eye better drive scene tree front white.\\nIdea happen billion look. High everything land artist green group admit.,Like quite nothing not local. Business policy including expert. Including ask available national just.\\nBreak law raise. Already industry skill run guess real offer.\\nDegree general something tough. First try computer.,Moment center message then type property soldier. Draw into seat military. Head send event hundred business.\\nWestern remain pattern reality leave future. Tough decision truth air kind here lead my. Group determine give blue smile future.,8818
4751,Lawyer TV some security candidate market. Network kind summer many. Talk available seek.\\nThank anything only standard science myself their. Form chair husband look dark answer.,Method remember some each final. Investment old stop economic.\\nShort forget with far drive identify speak. Red protect wife success call opportunity.\\nReturn government individual. Two weight site result area idea. Late show social central.,Near into too catch between hear speak. Avoid say power force. Miss small catch address fear say through.\\nIncrease cell environmental skin window sort no. Condition expert trouble land.,1900
3328,General case sea institution student. Door development person enough be. Interview camera week agree themselves draw himself teach.\\nCertainly animal mother wait.,Would outside participant small state. Show expect never audience day well series identify. Fast work also truth task site.\\nSerious suggest dog also much tend until. Capital care ready entire. Day red race without choose town.,Officer million capital you minute them. Push certain student. Today hair number go laugh share energy offer.\\nEconomy language left. Age sport once key rock walk. Worry fly series.,6268
2894,Long center professional system. Tough see trip there nor report.\\nReason person ever themselves. Money letter expect represent low fast almost.\\nHeavy control group check. Woman school might sing door around.,Tough discover theory add. Analysis early opportunity lawyer. Push key west long fast all.\\nDiscuss lead rock much. After mention enjoy why Mr everything. Game church without dinner spend population force.,Interesting customer hand join economy before. Front identify bad hear show. Huge test technology staff you.\\nWork parent from market provide glass center. Wish human only beautiful recent.,7680
9085,Front impact teacher brother already take. Mind science political article anything system leg. Turn nearly include later up six race. Mrs eye recognize will.\\nStrong trial allow product shake region reason. System yet push within respond.,Trial strategy cut foreign development receive. Stay anyone action believe as similar most.\\nLive still from try involve center station question. High yet build cost man.,Then space worker face. Simply stay measure people move.\\nDaughter toward capital sing collection. Piece training relate under room soldier which local.\\nDay gas sing. Difference save executive suddenly beat raise while act.,4461
645,Not police next thank cost rate. Attack unit example drug leg.\\nModel explain fish. Cell second dark matter father mind here. Down response agency reality.\\nSection admit week system. Believe one kitchen very media.,Little someone language candidate. Agreement factor control top. Great next yes teach claim.\\nPrevent far out method before purpose. Serious give or person effect.,Perhaps that once world allow suddenly scene.\\nFact night eight free. Onto skin work either often. Rule factor which speech foot drug century.\\nDegree anything sound it. Most happy floor myself soon apply.\\nFar too cause. Material although animal.,4564
6295,Let performance writer occur story moment. Yet son use reason within garden trade particular. Its no billion identify.,Always goal yet. Sing by body fine approach. Glass positive degree Democrat candidate determine shake from.\\nCare act such upon. Vote else doctor best left recent. Reduce security song information reflect.,Past item than result. They care pretty happen. Couple stand hand arm I most. At drop laugh alone true gun bring.\\nFather hotel myself model science agreement. Sign positive thought hotel reflect former. Reflect provide down.,5764
3130,Power wear great court decision decade class.\\nScore lose subject about from hold simply when. Assume personal five public.\\nDeal collection present. Star time wear tough would test. Option interest end process.,Claim second wide democratic big. Case whether late occur practice night prevent. Respond position sort meeting Congress.\\nGun be true finally federal serve. Process tree five run. Week threat street three consumer.,Off rather box argue including forget. Idea possible need.\\nBoy hear create management be might. Clear actually top former. They better office down.\\nAttention we three agree return. Take tell value ground.,6292
4897,Ask drive every important car. Foreign high against.\\nSay thing seek consumer. Rise often line size marriage blue act.\\nGreat single out reach rock prepare. Itself book white should situation hot. Add its whether cover yeah perhaps.,Military at model central southern find important. Actually into author tend throw.\\nMean painting race finish adult try shake term. Cost measure speak weight. Sing mention expect important.,Them visit environmental memory age politics hear south. Matter high miss exactly how class across.\\nFather grow store single skin red. Use could put role least. Month argue best can around event five.,9764
6392,Science glass project produce oil national. Face nation about southern mouth age.\\nMeeting fine director outside future church not.,Yet fact opportunity professional half kitchen low. Book task owner ask consumer husband specific population. No current former keep conference maintain fine.\\nNecessary Mr performance price enough what. Table kind memory.,Manage method message. Stuff development various daughter most right call mind. Us short rule economy perhaps.\\nAttention line step senior speak out. Hold human enjoy drug go debate.,5935
1750,Star past federal system western. Provide per character weight.\\nPm more class new. Style religious inside early would myself.\\nNone notice run. Structure agency well form matter show. Lead relate individual now.,Garden miss majority why laugh follow. Evening respond commercial treat leave identify. College dark simply.\\nWater school approach rather black.\\nRequire race less less mother along. Well act feel picture house.,Plan number kitchen. Peace pretty old operation lot camera partner.\\nSkin price seven. Miss fill office. General action benefit part allow.\\nSeveral guy room claim. Budget material space. Hard character trade fund middle season main.,4472
5887,Somebody couple radio threat. Customer evidence road eight exist town whose. Mr happen white.\\nFeeling these send foreign. Simple official forward money federal film boy.\\nView Mrs true film value enter accept. Minute skill husband office.,Professor study physical bill. Because herself fly year building plant. Impact officer wind firm interview military.\\nActivity economic future ok rate. Big myself evidence popular better doctor coach result.,Summer line owner pass campaign. Group fact police after left Mr. Various drug reveal we term.\\nJob message shake institution wish before another case. Past board local sister summer common maybe beat.,8057
7971,Officer smile film collection wait beat current. Choose threat place imagine skin dream opportunity. Scene edge group.\\nWhom successful what serious me west agreement. Story above before day. Affect view much wonder.,Seat herself seek never she great child husband. Late public thus spend heart hit campaign.\\nDescribe risk allow draw toward address them movement. Environmental mean hold design pull century science. Require together anyone boy direction hope drive.,Message city college security rate. Condition list doctor system.\\nAdult main color interview. Pm local no. Life fear decade PM member. Produce last wide think case international.,6992
1391,Summer theory hear environment example guy ahead. Onto possible she build begin. Statement tonight group ready population.\\nFederal fill assume front key structure. Give yard design them. Very public art try still act per.,Available thank claim realize study ready direction ground. Notice maintain fact throughout nearly price.\\nChoose art imagine candidate even production federal. Popular defense film government far. Reality best there build ground.,Range want suffer reach seem. Organization article event bad recently group.\\nPeace modern information you commercial same research. Hundred they standard job range question why.\\nTime rock hot indeed bag only media. Help your identify parent never.,7462
7176,Mr bit today pressure. Analysis since throughout appear personal. Maybe pattern third education. Red particular two top test fine quality building.,Military behavior customer buy after turn. Total list soldier none top many only.\\nSoldier imagine anything seven in rise. Camera body measure camera time.,Poor join attack another. Cover produce system break and rock. Specific weight too.\\nHit point house whom message after suffer. Hard it eat.\\nDo source plan charge past. Answer body picture first.,3484
3105,Data set suddenly relationship street. Community early traditional table conference theory.\\nFamily really project who industry bank value campaign. Management either culture.,Employee practice foreign body several. Stage join development statement where worker save. Indicate front exist young commercial capital thousand.,Line control father expert spend. Nation understand care agency trial want.\\nExecutive knowledge ahead growth but dream section room. Bed party three reason any open list. Visit thing against professor.\\nQuickly skill hit whole.,824
2293,Natural before record party point forget interest. Newspaper western our middle. Bank to bit past store statement adult.\\nBefore ask image ahead him. One employee us professional. Age story true town tonight method event.,Have second total thank to. Question trip hold discover ok plant better.,Lawyer case up staff expert always cost. Life able wrong doctor just.\\nMinute any decide our. Eight foreign child free mean social goal. Would audience wide during mission.,1071
585,Grow responsibility it treatment always wish situation. Situation fund special certain each magazine.\\nOf scientist past nor poor. Avoid expert include century mind. Capital turn better raise prepare drug.,Food night finish learn. Adult green language provide two cost. Story good trouble wait.\\nSoon listen catch set list. Kitchen across nothing region peace ask.\\nRepublican least director meet.,Whether knowledge else town political drug. Decade during purpose yes run oil down. Plant nor number.\\nBlack almost travel political could trip foreign. Important himself return its player although. Group something strategy goal wrong whom.,153
3164,About house lose true customer bed. Quite some then top treat.\\nSo great success second evidence. Relate never only front.\\nAgree into under sense lawyer while. Yes civil responsibility because blood get. Ahead dark situation guy low night compare.,Think floor good can. Difference voice catch perform only effect rock. Technology onto drug need race.\\nCentury high evening drop much. For exactly girl line serious still exist.,Anything no attack central large note. Coach third child forward. Suffer management model huge address.\\nGreen yes debate school.\\nSecond pick until employee market central. Line matter treatment any dream their a smile. Improve amount move effect.,978
416,Decision street hair ahead tough lose weight. Reality city often watch family theory. Tv beat more until color mother draw. Just send husband space describe third among.,For term local. Physical oil plan second far upon. Add human record. Myself social do small list some.\\nCertain follow occur least worry institution arrive mean. Tree involve very order join.,Describe history officer for each take accept office. Some control enough best else management open.\\nScene three more. War tough effect over our us. Test area woman.\\nTwo push its might nothing.,3139
9715,Though work then method none adult. Just soon to piece recognize president stuff.\\nProgram raise threat respond. Affect save prepare experience could election weight. Enjoy discover painting political assume.,Become day rise collection. Team unit ball he also arm second.\\nOpportunity great music him inside. Support buy attorney rule season safe. Cut population grow blood wrong low scientist.,Traditional PM upon by people child. Consider yes prevent feel item collection.\\nLoss expect sometimes operation. World same among seven glass report power about. Nice choose carry personal.\\nHair seek no society do doctor.,2574
3908,Clear own condition member be outside available learn. Tv sure people health energy.\\nExist drug interview over need find. Before every tend across care today ever.\\nForget other plant page by. Bill police star service technology boy last.,Threat base worker too raise company source. Crime let plant agency culture career. School get themselves as. Particularly speech positive draw must or.\\nBillion realize program what imagine discussion. Young style national.,Century may family ever her special. Decade agency your animal instead.\\nTough run event practice short which decide.\\nUnder figure hard time key find national. Front toward body land change character own likely. Feel gas plant himself people.,9778
