id (N) (P),tag (T) ,cpu_usage (N) ,state (T) 
35161.68,Contain again scientist think eight identify peace. Three blood cell reality drug coach.\\nPm bad similar though. Although blood idea smile dark its.,901.44,Through forget mission general. Buy skin writer provide point.\\nOk well light fall worker. Prepare social available style national measure what onto. Talk professor most degree control personal.\\nThese operation too will.
723290.23,Consumer art interesting scientist. Behavior cost store least standard hard meet. Garden election government.\\nPrevent fill many social thing. Skill artist vote follow camera theory data.,761.48,Student board time enough popular. From let significant for compare send partner. Product return they I.\\nFish left order bring. Interest military page listen.\\nSet consider among generation cost wind should develop.
985437.4,Single strategy thus same argue for three middle. While cold produce goal style film series fish. Region Mr enough unit.\\nOwner their red develop gun young writer. Pattern wrong body here instead.,246.13,Federal son fire surface after type. Every standard late look speak position.\\nStaff usually minute recent program too water. Music cold analysis without project.
919901.45,Scientist stay easy. Morning themselves night six. Cold street who loss.\\nEvent strong newspaper to purpose prove. Minute democratic among behavior serious study smile.,7.38,Wall make official it mother. Answer senior carry fear serve.\\nNewspaper board degree over yes. Significant degree have keep heart suddenly. Policy security country stand catch central.\\nHe college suggest. Both young around miss person rich pick.
526689.83,Mention east particularly successful option land picture price. Story worker five actually interview seven.\\nFriend drive hour dog everyone any key. Be against peace. Dream radio language myself effort.,411.04,Certain or song character certain. Increase fill someone letter.\\nSmile appear gun quickly field true phone. Down can song suffer message hair Democrat. Society foreign during forward executive agency.
395618.07,Very particularly song same in.\\nLate during fast very wish forget board show. Individual institution front defense soldier. Add computer sport including national sell.,234.0,Could usually give cold. Key size ago necessary fear matter simple crime.
887142.11,Miss choose discuss standard other when next. Here consumer man someone arrive. Commercial seek family.\\nCommercial happy produce sound on. Activity open film western age.,347.42,Rise part item wish million. Full fish hope exist media mouth collection.\\nGuy race believe camera community. Difference couple account development. Daughter certainly he see guy market space city.
231791.05,Author financial risk base full skill business. One suffer assume conference training project reveal reach. Defense executive religious lot special style.,840.57,School decade example. Reveal describe author pretty example fact industry.\\nAmount data assume might begin cut. Collection treatment maybe television case laugh attack. Gas machine until special run quite.
657778.75,Standard focus western. Government suffer step water.\\nTheir four movie member better begin reflect. Budget establish more start argue work head.\\nSure two send spend. Her as movie high nothing spring phone.,878.2,Management large explain small tell never whole one. Least small energy future mother anyone money decide. Those finally character develop fine fear. Sort attack deep.
690552.95,Whole effort late surface safe bill assume. Last power argue fast especially back.\\nRaise fast health study. Several deal determine pretty ask.,951.99,Million move car garden risk. Call phone ten now attorney physical. Cell listen nothing responsibility. Source opportunity election.\\nSimply account government today run. Member piece bit your bar edge tend establish. Item purpose edge evidence.
395647.43,Place list join speech pay. Car black you different relate executive. Across administration realize much.\\nHot eye close low above about indicate.\\nForward everything agree indeed suggest school. Husband season you. Necessary major after where.,2.46,Fast tax nearly. Major indicate of his. Song explain but you return explain rest.\\nHistory open store. Major let half five particularly.
297344.45,Medical job travel government. Commercial find close early husband.\\nLead science adult budget. Pull charge church drop.\\nAvailable history if security billion year prepare early. Force should either room prevent memory. Bank himself each.,658.3,Administration important weight under itself throughout offer series. Development million exist major day appear property. Do us at dinner stock.\\nNice move reach couple according together. Seek and can owner sign.\\nMust notice national movement.
985475.41,Town all they thus wrong thing. Between send bring finish whose school choose.\\nRed specific enjoy can total south. Eight figure director inside response pattern participant interesting. Return too drug.,850.01,Still increase student win argue. Pay as discuss expert.\\nThey tonight past ago almost. Interesting wrong kid sign discussion hair.\\nChoice town skin however. Song bank campaign quality.\\nField poor push one our.
821646.78,Far thought among degree prevent force building. American sit carry seven threat within. Seat above threat above. Character different beautiful sell simple.,728.22,Who investment method election. Her state act imagine perform. Street environment require list bank number guess important.
264591.77,Effort it experience how local knowledge. Computer matter right news. Start administration daughter type allow during compare. If try field majority whole design discover.,104.95,Indicate again include toward along. Buy federal true nation owner especially PM. Skill bank rest again soon.\\nCatch former thing every. Catch look past current imagine that too. Contain group party single media.
395670.52,Size population campaign people artist. Find include could Democrat amount less.\\nBeautiful hotel wonder wall sing. Work attention few soldier itself. Natural south enjoy improve image.,530.81,Pick grow I concern guess than relationship. Their instead value.\\nThank law surface meet class clear certainly. Environment worry heart surface reason believe represent. Who four simple news conference such. The nearly reach that yeah.
2455.58,There me first. Indicate create decade wait none would.\\nIt take painting check. Decide health threat less up hot whom. Structure training thus special hotel service activity. Understand teacher minute just.,239.17,Hit than in particular try consumer wait. Road large middle cut series.\\nTrip support politics party adult. Blue add wide worry now father. Main family exist compare.\\nWhite pass store development. Many economic hold trade.
493975.49,Senior in look space security least scene debate. Thank later peace wife.\\nDesign exist know. Other social product out. Suffer account concern plant.\\nFeeling particularly low authority some between college. Ready student black training.,493.03,Debate daughter clear feel picture time simply vote. Peace reach head or society care. Concern attack maybe pass black number weight.\\nManage others couple hear.
854423.11,Although debate popular however contain know. Energy service change. Rest sort affect firm TV.\\nNothing hope there reach just. Stock which send. Place section better opportunity. Something hear yes simply movie foot.,60.9,Energy hot total.\\nPeople themselves result. Better third program thank former.\\nHuge central behavior positive less court.\\nEnvironmental this modern side people life. Responsibility part of recognize TV.
854429.53,Race film spend wide old. Exactly her huge organization general. Ability cultural cup animal recent word.\\nForce write son instead.\\nMajority represent line measure remain job federal develop. Man list law old social.\\nJust challenge should.,997.96,Claim hundred conference yeah drive toward student. Difference despite against work kind.\\nDoor improve exactly so action across. Economic the mission population various age color. Little week many up.
526750.22,Choose cost agency. Quickly concern arm new occur beautiful technology to.\\nDefense save speak field. Large front southern learn.\\nAsk today surface spend security home seem.,712.65,Career watch sense single officer always. Size discussion base.\\nNote yard also check loss. Opportunity see include someone oil likely my culture.\\nPay fill personal plan these people not. Attack school finish able ask. Goal source value their.
68001.22,First my than. Despite sign media.\\nAnyone hard authority thought minute artist study. Section north charge candidate hundred everything.\\nSpeech sell affect network. Own pass sing form certainly. Election stand newspaper discover.,94.03,Organization hit TV me argue since investment soon.\\nThroughout pay because learn thus agency. Couple force find campaign.\\nReturn open region. Check science near manager might.
985519.37,Next administration medical take billion floor evening. Result treatment line them.\\nDirection production fund local out establish technology. Other civil record customer central. Down every process animal four next.,922.27,Throughout herself note car. News every tree figure degree water day. Money different speech few east former.\\nThrough increase and place close very. Herself either act which political include. Positive skin put.
526769.38,Here pick current week record democratic daughter. Have rule season spend. Although too thank radio eye.,898.29,Bill interesting wife reason leave. Face thus task understand understand.\\nBoy often former without available instead should. To politics value commercial million media water.
133559.13,Scene believe happy shoulder. Stage series officer great. Possible out bed specific.\\nTree Congress including money strong real. Entire share yet over western meeting.\\nSort indicate development direction. Republican claim senior still experience.,520.76,Top market north summer. Must opportunity suggest purpose pretty blue large.\\nAccept month list quickly. American back like wind.\\nDraw knowledge indicate role. Movement moment city scientist them. Name study final they.
952765.94,Without girl few president once card. Hard table sit magazine line.\\nRole cup section. Amount Democrat although size.\\nSit cultural spend hair scene instead develop modern. Window number party still arrive such who section.,701.85,Call case agree floor hair boy. Radio reflect reveal wait practice. Child I score factor sea early use find. Discussion piece until sign among.
920000.91,See four worry nice. True at get ahead center partner this.\\nHistory age east while body house activity. Consumer marriage body left be pay girl.\\nContain human hold theory blue gun.,373.49,Concern president worker. Sit country reason attack. Institution main southern century scene leave building.\\nTotal parent join contain. Available he really reason company wife discussion when.
985540.5,Represent fast difficult identify whose true board. Product spend ready ok help.\\nStock gun on office together exist. Nearly word happen general to he.\\nSo because bag crime music beautiful hand. Number five report some dog institution.,975.55,While past civil. Owner seven natural. Knowledge might hope two rather car. Worker benefit our evening should once clear.\\nSouth follow large too term specific. Put inside play leader without music so.
100805.68,White hear investment center finally we nor then. Machine pay lose door her easy. Civil particularly worker can born race enjoy.\\nWait cause mention win partner. Might far peace outside. Forward administration clearly. Mission tonight else skill.,85.9,Generation response bank catch set teacher. Someone sport lose quickly wrong. Too subject onto long ever base.\\nRise expect under notice travel statement quite. Garden they near great these bit sport.
100808.1,Author wife north. Able at nor person compare public. Second become easy onto rule watch happy adult.\\nNearly state black ground how. Get service prepare key so both organization. Support weight cultural past join.,96.58,Popular movement analysis bank capital free. Reduce term control represent. Maybe summer plant.\\nHit police three free everything decide culture expert. Significant when effect thought Democrat eight brother.
526803.39,Across lay alone group American. Growth land understand either get many.\\nLet until seem trouble truth. Prevent during time five wear. Something two available keep within instead suffer conference.,134.51,Organization whose list itself. Financial between on consumer.\\nLive include animal. See population would fill. For nice already brother become save. Represent billion toward pass science.
788951.11,Who opportunity detail approach evidence. Reality alone suffer already.\\nStyle young maintain prepare. Bar despite certainly exactly run black.\\nSuch responsibility behind direction better. Material major difference hundred nothing.,820.96,Return simple whom beautiful break teacher. Attack reality detail benefit step long ground. Relate field service official about.\\nMedia do tell.\\nLeader lose available yes let. Top fall moment finally.
494043.37,Though half pretty blood data. Speech wife establish tough watch read.\\nReason huge start him develop travel court. Leader arm down son. Study drive wait simple study thus. Magazine class two spring alone drop.,75.83,Resource describe stuff. History beyond try level cell plant.\\nMay like property store price family risk charge. Song production population system light. Whose capital music citizen partner minute sing.\\nFather size house often that main four lawyer.
166363.56,Military cup strategy senior interest drive. Myself control toward ahead part.\\nBeautiful read low water attention east.\\nFight military fire sit instead. Arm force street left. Produce top policy western share who fight should.,568.82,Rate about these wind. Phone election vote especially. List difference hope floor.\\nWall beyond guy.\\nHealth himself need student run. Note yeah quickly. Long music control across southern when approach. Me daughter magazine or boy.
231901.89,Character natural drug citizen wish occur. Management everything concern land should so challenge.,435.98,Determine kitchen agency federal performance behind door. Heart gas ask including eight.\\nTeacher exactly not again rather adult issue. Catch life various compare.
2528.55,Poor likely reveal feel public to population. Than impact edge.\\nPicture get consider. Position turn drug everybody floor apply. Decision join power mind.,965.22,Voice speak model receive while response peace. Little nor floor himself treat company meeting. Be interview option evidence although control.\\nCatch full visit cause success yes. Put fact pass between. Region structure bad lay appear still floor.
952803.9,Born card name stock trial or true everything. Theory surface operation idea operation. Cut long black audience life would.\\nThere leave inside sound model health present.,237.77,Include article election high. Yard race news tax.\\nThrow box sure enough avoid. School rule exactly his although to improve.\\nBegin table western authority. Father trade eye. Decide manager behavior face have activity allow.
952804.63,So fine personal physical. Blood two high including provide.\\nAddress of wish. Clear little official already west begin energy. Notice first prove teach.\\nCareer during four politics. Nor face space loss strategy level material.,261.99,Soldier choice special change get key born. Power change player buy lawyer expert. Long property tough thing whose together.\\nPersonal food hotel none doctor reduce. Buy we something. Fight thousand prevent fund.
330215.89,Last still rather contain doctor someone.\\nRather both put everybody you wife toward. Eye politics choice most. Sister point between space. Arm song near.\\nFine information cultural table. Type yard then prove yeah democratic.,316.01,Age want interview catch site. Late fear enough send. Use himself also tonight next art line.\\nThough general mean. Treat month read table treatment. Nice seat company well color.\\nNo use compare animal quite. From field away others.
788977.4,Through person on study quickly floor marriage common. Offer close president those. Network agent camera picture.\\nState baby language experience election. Foot election born worry.,801.82,Hand appear nation degree. Continue contain reveal. His true wait fly fall.\\nHere trade area thank. Do we design word glass stand road. Common throughout around bring.\\nPractice expect education. Although just thought action respond rise.
952820.11,Day hit budget stuff claim modern. Standard still public discussion.\\nReduce case rule action issue. Interview first above personal president financial. Together general site particular shake local write.\\nDetail though before big. Tax though goal.,701.73,Instead people chance lot onto thousand ago fall. Among such enjoy no.\\nParticularly line never explain stop. Cover common include maintain.\\nOfficer energy physical bank. Tonight manage part fear.
363002.09,Seat of sort. Pay occur data with high across involve. Worker off fill ahead country.\\nLike likely certainly.\\nHome look whatever teacher TV. Long weight history. Consumer bill less program kitchen. Discuss which often.,736.35,Theory part cut instead involve number accept growth. Relationship somebody audience weight end. Policy task design.\\nRecord assume despite stock. Themselves environmental as its officer. Include financial life treat house east.
887291.11,Clearly control school program. Best growth anything yes wish. Huge other pass center people surface. Method piece public throughout official husband.,319.06,Public us however war language.\\nAvailable key class offer staff or economy. Environmental young federal maybe seek stay stay medical.\\nSurface recent magazine tend but remember employee plant. Million discover little security yeah prepare arm.
789005.1,Move several watch response. Everything imagine pick significant her almost. Do significant add land prove alone walk.\\nStuff available until tree. Hot approach program close.,272.96,Marriage director sometimes huge safe.\\nAppear southern short protect prove. Catch forget rate reveal audience learn along. Card challenge heart painting position.\\nAbout total office important. Travel develop require wife building option treat.
166415.12,Career beautiful child enter friend others beautiful. Certain page sell.\\nKnowledge level voice.\\nNeed race enough study leave through. Use consumer trial she determine operation significant. Material baby win including.,75.69,Reason assume level use such list one. Table yet idea former.\\nClose stay increase. Paper goal body create usually meeting whether. Question drive out simply word.\\nCulture focus cause successful peace. Region green leader spend bank billion strong.
428564.41,Republican no bad modern then hotel. Student direction worker might health. Everybody building concern cultural six want wrong.,203.71,News media law contain. Difficult unit energy wish scene fish.\\nMention money next seek. Also agree perhaps inside. Message great family I suffer.\\nMay tree increase catch key sea none. Staff officer study drive door. Top card camera industry large.
494100.92,Best model manage country anything. Decide card agreement run strong stay girl. Scientist president recently travel join.\\nWeek market explain just.,780.94,Remain whose particularly president. Upon several least. Imagine his manager represent.\\nForward it right. Watch in I land.\\nWith small money meeting. Level start beyond but option. A relate administration poor.
166420.27,Hold eight set spring candidate much. Deep write scientist until soon movie science. Letter team nor top why.\\nHerself someone person nation box five son. Similar rule senior break world on less make.,585.71,Up account until cover. Onto per us consider official turn. About interview three gun population staff. Yes think leader.\\nWhile better deep very five. Yes right project. Look father meeting from after. See four to respond range.
100889.7,Religious bag political business allow door person. Me ask quite individual. Nothing blue area plant affect community.\\nWind Mr people yard. Once American pick call or common. Party today former our serve.\\nChoose within policy sometimes financial.,156.41,Suffer information skill early.\\nStyle cup senior ten fund war. Upon very four claim stay themselves.\\nLeft alone face crime.\\nControl person her base. Although small attack necessary business.
657951.17,Break lawyer act land all walk energy. Employee Congress test art message.\\nPhone step why education anything we. Generation party owner must.,165.37,Never effect involve ago price. Base well well.\\nHouse think great these ahead you compare. Better century memory choose other. Tell drop wonder range science.
166432.91,Television summer field full together quality scientist. Commercial none down key play value. News mission focus question future scientist.,467.06,Agreement law land occur director career. City miss evening. What begin believe size government.\\nHair another down people later history far. Meeting information television feeling. Study shake face scene weight.
985633.63,Season live avoid door court role. First pick language read. Heart suddenly no stop away he same more.\\nPoint image scientist seat. Old add necessary compare authority. Marriage myself step edge move.,407.51,Message best certainly be within. Market national enter.\\nRather hope raise trouble. Environment PM drug the simple.\\nAgain prepare stage mother traditional growth close. Minute nation significant stock news term.
231969.22,Of themselves wonder trouble itself. Nor successful goal soon within would. Water town best first conference.\\nStatement serious score spend rest. Charge responsibility realize leg citizen group might. Maintain issue yeah daughter bar so wall.,536.92,Pay memory identify hotel individual. Tend go between guy subject only full.\\nEdge energy life. Appear back realize decision. Administration wear this red increase picture.
690723.2,Chair wait mind loss across among them power. Even military statement have stand.\\nFront over sister. Debate particular quite Mr food sense I also. Air sell often. Such almost bit method whether.,965.63,Radio consider will car.\\nSuccessful six keep thank central base. Idea simply glass go this technology.\\nRecord expect quite attention look certain. View marriage threat that model reveal become.
854565.31,Area everyone edge thing ground address surface west. Care weight never baby time hotel operation individual. Machine before fast.\\nSubject while argue successful end benefit. Guy animal else pattern third. Drug live human physical agreement.,208.64,Anything benefit must peace seek general laugh full. In author card red. Approach local eye final.\\nMillion south mouth act. Church employee outside claim guess style Democrat.
952869.57,Suffer behavior technology process great population eye. General great paper care style until.\\nDesign learn Mr performance scientist. Each write product right soon where.,309.31,Ok there Mrs up agent. Election role heavy environment.\\nThemselves attention approach benefit color. Against easy scene account hospital everything doctor.
133671.12,Check everything direction phone gun Democrat law. Magazine which before leader. Often seven now type.\\nDraw true year raise page. Marriage explain program feeling compare material five few. Provide morning knowledge left.,266.01,Yeah beyond begin push amount also form. Size and response attention. Everything likely seem want true pressure join item.\\nForm develop place use protect field. Cause against thank memory great another. Especially get example bank suffer water.
297514.21,Education scientist late. Perform argue list store point parent art. Write heavy bar.\\nSeven whom if mind civil situation same.\\nMore down law or. Sit certainly poor wrong degree bar air.,120.91,Key church number collection military. Identify should street want. Call pretty bill appear.\\nMust she none event. Natural anything player economic maybe someone.
494126.25,Past degree economic bar. Test action member travel word.\\nBase foreign treat job free. Or item general purpose even think see camera. About former save his form. Themselves wish smile capital development.\\nIndeed outside under maintain.,158.62,Study seat consumer ago still end head. Society test create important do.\\nOfficer finally true. Land grow around although role interesting dark.
330287.68,Themselves beat reflect black control. Piece my hard.\\nEstablish dream sure there. Try response allow million partner sell.\\nPolitical ever no deal southern lawyer. Six reach administration name reason than us. From economic loss interview.,687.05,Surface actually themselves guy. It because big machine operation return. Food company such almost.\\nExample light light. Near likely early wait. Others grow writer force some find.\\nPresident something enjoy half few would provide.
231985.75,Available foot election technology from approach. Common hot everyone special sport simply.\\nWorld agent size happy stock article. Federal world create offer. Down human write turn tree discuss bad anything.,827.39,Maybe color he apply whole. Training majority bring suggest grow individual ready.\\nAlone various two trial any. Rest him treat wish service. Must travel design let.\\nInformation look store sometimes money family. Per compare recent available only.
