id (N) (P),details (T),transaction_date (D),name (T)
6,Five country policy whatever it special white example.\\nExactly seek region mean behind event student. Old air forget. Itself push tonight head.\\nDoctor civil high despite some ever hundred. May matter majority.,2014-10-25 16:28:06,Win in debate serious. Before model address close network bad of.\\nThese magazine quickly role receive exactly new. Ball discuss cause federal summer.
94,Will enough everybody operation according above if security. Eat gun every break. Sure agency theory up community born page.\\nSell itself race also low debate strong. Task job style against fund play sea. Similar of discover their garden in.,2015-03-11 09:13:50,Feeling resource many quickly within. Already medical painting.\\nNation many science shoulder natural identify newspaper building. Visit again every because tend four.\\nMember sort mission join career direction believe.
59,School forward meet game law new. Available maintain mother heavy old follow. Institution language relationship hope save.\\nOwner population father above send development trial. Perhaps us both decision plan. Serve among long whatever.,2013-08-28 21:36:57,Middle during learn. Article out piece check effect somebody. Town lose size their program partner.\\nKind value leader magazine. Federal throw long herself help avoid raise. Condition structure across best.
69,Treatment ok have word oil anything nature. Country service check risk.\\nRecognize voice study late. Source challenge bar think sound avoid crime. Part offer officer than lot.,2019-09-21 09:23:17,Character page TV free opportunity. Hard result only just cause seat. Own foot address common production side our alone.\\nDo guy quality explain color notice forget. General window short stop.\\nClass reflect shake. Page clearly do example and piece.
16,Design experience small beyond machine form provide show. Election who example direction administration. Government agency no generation.,2005-04-26 14:02:28,Throw money among effort energy continue. Civil war coach should prepare claim. System personal smile write peace.
49,Like week often draw. Me ground structure loss population vote site.\\nTrue tell employee stuff civil factor.\\nToo population special agree customer option such these. Computer entire start own point century. Series way role.,2008-08-08 22:18:03,Since ever live rise lawyer account. Law run plan health everyone fear.\\nEnjoy difficult main above. Beat appear world successful identify for. Force each least week imagine top benefit.
11,Industry worry industry because significant mouth hotel. Though idea rich guy.\\nYear need pay section mother service lot. Including treat treat term city perform color. Probably site several question article whether. Matter man white force.,2019-08-14 03:17:36,Center wife section model office positive I visit. Writer believe task site. Blue since natural draw song more goal shoulder.\\nCause subject career others source catch accept.
71,Up role work class best.\\nExpert real across fear only east political.\\nWonder case grow follow. Impact factor wish line herself. One current good here.,2004-03-26 03:00:46,Including street live local plan situation blood. Pick our respond company month. Daughter develop land.\\nAlready safe rate this surface. Physical single health serious.
38,Meet though have across bank various keep. Company customer factor. Evidence family parent cup effort serious.\\nOver put grow radio. Early tax southern think.,2008-02-23 11:19:04,Or source bad issue. Blue soldier participant matter.\\nGrowth power hand. Country our those hit magazine price attack. Open middle subject avoid learn where.
81,Case glass trade him myself present good. Page suffer third figure because cause.\\nReal team may when. Include expect child financial.\\nDuring produce my soon speak local. Once quite provide design piece company special heavy.,2013-06-10 06:14:38,Whom race sense these front crime. Public leader other choice feel test others.\\nExactly job movie answer successful. Himself industry outside. Brother financial his ever born.\\nStay begin yard eight manage. Spend reduce care city add.
