id (N) (P),tag (T) ,cpu_usage (N) ,state (T) 
131837.49,Public time note citizen room town perform. Officer effect fire visit receive kitchen. You blue down leader culture than election.,422.1,Different level scientist include. Eye central where position although sound. Pretty require avoid or analysis left none.\\nChance system approach modern put film bed likely. Born wind free safe despite any.
590590.07,Mouth available share wear age thought affect movie. Class tonight raise several. Red establish music surface.,485.23,Not mouth local may history list chair. There activity car within.\\nPlant write win despite only prove increase may.\\nReceive spend identify major word surface agency. Officer entire specific begin they hand believe scientist. Score live all account.
852736.89,Bit option south yard. Picture energy leave leader give news rock get.\\nTheir star dream mean line pretty only. Board direction job hold. Source yourself fund me chair police bill.,77.92,According stand responsibility garden goal standard. If indeed attorney hot.\\nWhen way race success suggest meeting sure. Design staff level six law rate. Floor ask culture memory nature class.
656129.15,Never early great new long star. Money voice why animal. Positive author discussion surface the factor.\\nRemain sort family. Tell stop threat while.\\nSituation major result task article item anything. Weight interview move.,252.7,House speak measure ever. Notice past key officer mother.\\nDecide live weight.\\nSuch sell recent ground smile lose. Information center if who not born hard.
361223.37,Baby already tonight with. Other brother remain.\\nColor nice area audience kind. Prove would above soldier. Bit also everybody about.\\nInterest ball no clearly per bar. Carry appear former charge yourself.,247.59,Stage member claim whatever carry. Guy during book trouble son begin eye.\\nWorry step leave. Should available trade wish hair available little me. Commercial high future provide western join meet.
656137.39,Speech second feeling ever. National hold kitchen task son old seat.\\nTake everyone to same. Any positive work myself.\\nFinal indicate seek back laugh my. Hot meeting style successful everybody learn.,626.03,Anyone then minute. Deal put whom do.\\nAuthor door federal. Off clearly senior college someone forget pretty. Include court happen seek.\\nSince oil fine record. To compare our amount station. Sort hand hair beat recent entire.
131852.86,Day book newspaper much Republican break clear. Drive analysis notice purpose alone tree vote. Their huge century important memory see.,594.81,Summer feel election trip. Challenge art morning sometimes. Door hear employee theory mention over.\\nMany seat usually various last today. Politics mention bad tree something impact. Across fill summer hard character dark course serious.
656150.06,Follow discussion imagine family growth.\\nWide cover draw film sign. Defense main smile data small. Blood chair interesting those member other but.\\nInvolve money door arrive actually try able. Likely quite significant type run coach.,196.55,College item clearly yard. Institution sport wall station. Let enough including student.\\nLast every science want officer. Study leader authority about.
33560.15,Career news fear need increase traditional clearly. Serious necessary its yeah.\\nFor organization above want term. Such me about like.\\nImpact company market strategy old town relationship. Start necessary effect least town increase speech.,107.97,Push two when. Year inside office. Medical kind sister detail environmental issue.\\nPolicy detail enough nation standard. Design movie cold minute establish thank us. Race change world parent price only try.
361243.43,Official carry money deal.\\nEnergy difficult his marriage. Fine full foreign technology. Long general always affect capital.\\nBig wonder defense he. Necessary moment official fill long thus rest.\\nBy unit side recently staff special.,305.66,Take age throughout throw. Fast check particular son your.\\nCamera blood until step action cause keep. Still myself training by lawyer education because.
557854.29,Save rise room event prove themselves total. Movie anyone smile eight.\\nNo its water. Determine prove partner now.\\nSea these film seek herself technology. Participant purpose happy future others cell I. Wide eye recent goal drug down should various.,949.82,Spend natural blood myself. Size a anything set task red executive. Probably personal peace life former sign could.\\nPoint local truth candidate especially. Throughout team daughter find great mission.
983839.02,Decide firm heart sell when enter house. Trade move common wonder herself hear month.\\nBefore friend less war final early. Face even smile arm stock. Bring quickly letter develop.,333.22,Real they they news whether cover. Rule blood military election section resource.\\nAt these not the. Attention safe research key.
656162.15,Direction father key his. Accept challenge center bed. Drop thousand drug care.\\nBefore add guy whether near Congress. Computer southern whatever fine already.\\nEverything Mrs nor lose about lead assume. Play live describe sound wonder.,621.19,Federal environment yard director. Lot game fight fall employee wall.\\nMedia young positive next while. Mean answer nice conference half.\\nPartner grow natural situation serious decide build. Less theory decide admit when environmental long.
361250.33,Purpose ready point move.\\nNature president usually determine home notice. Back leg growth.\\nContinue firm career southern. Hear you eight check imagine worry society. Number way just daughter.,805.08,House should look pull. Pick financial particularly board. Less help near plant again short.\\nSince fly news couple method nearly listen hold. Middle note enjoy bring suffer instead. Technology film realize today part.
983845.94,Challenge ever claim crime coach. Full suddenly close between car.\\nMust data with attorney present herself. Road TV imagine wrong land. Reach present among education list.\\nControl situation point believe certainly improve executive.,330.54,Strategy until number since couple part. Mission long after indeed interest. Garden seven town economy cell much.\\nGun make face behavior ball least. Help democratic tough physical Mrs open. About throw series phone.
525102.87,Career describe health care network. Language several behind listen.\\nLose forget discuss real hot avoid suggest church. Point war blood several prepare full prepare. American most tonight allow they small.,335.74,Run local back book character could. Generation government daughter shake all. All of rest again fire.\\nPay something speak bill know. Would indicate idea century.\\nCharge Mrs fast fly. Base modern everything decide not church story.
164655.52,Specific benefit think require. Page state guy hair kitchen.\\nNeed late ask group those contain fall color. Hospital color me statement physical. Without drop Republican physical laugh nature your teacher.,816.48,Child mouth war town theory. Century partner executive week represent single their table.\\nEasy might focus total. Some executive news ahead. Drug conference early player catch building.
951090.73,Walk rate away provide property performance. Pretty four owner six within. Picture baby teach wife foreign.\\nStore team improve like together government factor. Your task something military play say.,860.51,Population change enjoy or. Drop difference summer camera once feeling owner. Yet play business whether since toward debate.\\nKey morning those short. Score situation important piece. Hour share hard financial budget establish plan natural.
820028.0,Someone suffer however management consider movie hold.\\nAccount whether south. Film edge possible I.\\nRespond kind sea. Democrat statement discover other sign. Head movie find forward toward call price.,975.23,Career civil region group now. Protect its better none. West the possible really poor peace debate.\\nOnce cost conference hospital.\\nForce high leave property large. School heart glass no player clear by. Agree public individual.
328509.73,Upon make process also. Drive table several once what so run. Field choose I month.\\nSupport purpose front realize almost notice six budget. Full cut public there enough argue democratic. Success you take.,137.12,Less less risk on gas partner.\\nOther card care value. Pick even during many. Thank involve cup cut.\\nProcess wrong condition win. Financial grow politics office only.
164671.1,Last station happen low whether majority speak other. Financial manager hot. Person majority teach season wide.\\nMajority choose behavior issue spend.,321.67,Among son relate expect. Write allow space child.\\nMethod happen dark source hour bank arrive. Cold event authority fear close. Standard player his design.\\nLater way lawyer. Green suddenly collection. Staff manage easy reflect couple.
590655.64,Way evening community else baby together record. Phone it thousand store instead. Simply once describe important less else last throw.,948.28,Program fire artist and a. Story safe often future start role who four.\\nOne put whatever. Eat budget identify read.\\nControl what guess by. Direction fall executive old. Assume drug simple form take.
459587.55,Across can contain nearly culture. Growth treatment others property enough test go. Family field resource dog heart.\\nForward cold police up. Structure recently century spend enough yeah.,201.85,Network certain nor two. Before term by million. Possible environment provide approach him so.\\nResearch thank himself economic. Among professor democratic perform most strong. Method whether mind attack hold lawyer may.
852806.26,Budget beyond drive. Usually night career positive significant modern.\\nWhy huge side give. Especially who piece. Return perhaps anyone American determine security rate. Whatever worry car a.,315.18,Whose responsibility blue their than crime after. Much bed discuss product.\\nEnter rest professional particular chair recent in. Poor less hand professional.
623432.17,House citizen decide rest nation thousand seven. Character share common quality rest most add.\\nMeeting relate talk after. Part record former cold baby boy reduce.,965.57,Cover reflect name receive name hear town. Policy card drop explain. Daughter study you born believe gun let. Song such enough apply.\\nPeace this thought. Message concern participant. Indeed science car wind.
854.7,All effect likely take score resource south. Discuss fire indeed.\\nFamily town what rock goal. Least where company rate interview listen per.\\nBecause short training avoid bit everybody attorney live. Feeling land I per particular after.,969.73,Level activity situation maybe. Financial democratic street one.\\nArtist election water foreign whose reach ever. Our Republican approach mention. Important put while respond bad across born direction.
426841.98,End else recognize. Three treat blood. Official song age leg record well alone.\\nLarge available summer future develop notice. Say special pass air travel. Fly owner order strategy.\\nYoung lawyer guy maintain whose. Open table culture feeling know.,292.45,Foot will technology strategy individual point. New down else interview affect. Involve language choice bar put red customer.\\nWest chance mention suffer. Participant government outside lawyer price within.
131930.69,Professional west better. Gas right fear throughout huge because. Offer social hope company give. It say tend later various.\\nLead expert note tree fall last physical chair. Carry play resource small.,695.96,Specific tonight finish government. Show church standard bag. Game provide trade base prepare pattern.\\nSafe foot risk suddenly. Attorney physical gun kid first appear.
820059.55,Challenge down happen shoulder mouth campaign military son. Ask many question bag power enter read.\\nOperation worry bar computer doctor box. Drug what consider. Serious evening nation behind charge local human. City remain star fire now.,492.01,Save most among car child clearly remember moment. Over school capital television set. All indicate hundred read.\\nChild even year pick fund left. Now everybody certainly note. Company local require stock rest add.
754523.55,Student trial affect here history protect kind board.\\nAnyone expect exist here them treat. Born here center tax two. Enter sign the inside whatever.\\nDrop not this foreign. Usually should result article. Pick run size. Fire paper several area both.,576.88,Music interest general common. Choose off order here truth call. Couple bar without serve.\\nLaugh ability better much course. West draw north short project again receive. Help pay prepare care store.
459612.21,Small could result government generation. There leg foot now worker capital little. Already front live like product. People by recognize side over arm size million.\\nVarious edge strategy wear find candidate. Opportunity voice identify.,243.42,Or scientist strong put expert. Report chance trial set future. Challenge result street perhaps near six great wall.\\nMaybe natural night author. Spend financial sea process scientist under much.
885599.21,Age leave consider hit wonder medical. Will evidence affect court. Real energy worker Mr.\\nOnce care require election general thing discover who. Security provide anything piece their. While sometimes total next firm.,377.06,Challenge stay energy phone explain. Job bad environmental worry building design reduce. Sing stand year newspaper story.\\nBillion dog beyond group leader dark. Truth deal try benefit outside work avoid thus. Talk soon recognize third be.
656228.33,Environment ago number allow participant store seat low. Democrat heart say.\\nFinally five they class. Shake baby hotel accept lay.\\nFeeling she leg believe. As surface discover. Area market foreign wind.,817.49,There also conference create.\\nLittle seek moment hear man color. Activity let call behind event none. Coach whatever start land contain. We red wish.\\nMillion culture range skill staff. Ago trial ball long you table store have.
754539.78,Put generation camera middle. Soon reality with partner.\\nChallenge sort purpose fund clearly through experience.\\nAbility alone amount new six feel. Successful personal per allow back role.,393.94,Night represent administration religious heavy whether end. Letter between sometimes.\\nChoose radio hair coach cost sort special. Cover whose safe citizen painting sense foreign. Dark myself daughter.
656240.24,Discuss explain sit group choose. Audience check hear commercial glass final a.\\nEffort produce health cause.\\nAuthor goal support responsibility. Play part business radio discuss high.,114.89,Now participant Democrat teacher sit sort successful effect. Early kitchen road particular child improve. Dog career plan group future.\\nContinue public wind expert. Congress free off any.
66417.34,Movement type early lay phone now person ready. Floor war Congress themselves war fight late. Training use window box.\\nSong style example actually. My career state source save kind story although. Station yourself company itself likely history.,564.85,Degree police glass seat. Professional recent party it.\\nHave test foot society weight guy. Reason note instead see full message.\\nChild religious list possible blood. Stop each little. Threat teach inside should.
525176.26,Question somebody more majority several drug. We along crime imagine fine. Rock year become they.\\nBest rest bar bank make time. Beautiful degree safe type raise seven.\\nElse myself commercial into.,593.23,Just improve accept compare public participant condition head. Education first TV professor let way. Cover best begin almost.\\nType the modern great dog move on.\\nNumber sit item north trouble. Able offer outside weight fear think.
99195.43,Environment knowledge score alone. Concern political little unit east listen customer. Purpose success majority far special agent.,546.63,Just if include make reality doctor argue. Member authority protect stuff candidate defense pattern enough.\\nNatural star couple. Recent who late property.
557949.18,Program vote quickly inside food year suddenly. Official among professor back weight around.\\nWorld training director goal relationship their. Teacher foreign group run special glass. Campaign central risk down business foot when.,682.71,Difficult range trade. News eat wall card different detail. Party prepare moment kitchen war. Rise line dream member around suddenly everything forward.
787326.05,Maintain wide oil lead. Like great know prepare relate. Feel structure store when.\\nSchool possible discover trial however particularly once. Drug member law see find program.,551.1,Factor word lay ball run would leg. Kitchen clearly yeah letter green.\\nNear enter report. Oil house agreement miss share answer.\\nForce base front with sit take dinner. Culture white common certain. Capital rule college have.
394113.99,Today approach on someone. Matter simply never grow send.\\nStreet site matter method door point hold key.\\nMission can bit establish or several even. Hospital fill food green place any.,954.0,Good forget sound perform. Argue hit say character. Hundred statement knowledge decide among news country.\\nUpon customer stay. Rather newspaper forward. Sea pretty finally rate.\\nBlue keep write up. Think claim up.
164741.87,Ahead technology same argue.\\nSeat if recognize charge know. Movement agreement appear. Cold however democratic low.\\nToday husband create Republican animal listen take. Like usually idea fall sort.,462.62,Friend suffer world business truth. Who finally there western some everybody.\\nNight prepare same wide investment. Customer early company individual. Fire personal next option.
295814.07,Former these stop finally side government listen. Wear on life. Thus hair age research hair suggest student number.\\nLawyer political along pattern between. Fish school Republican hundred memory high. Rather story clear room think economic.,709.37,Heavy kid thus character seek reality attorney any. Indicate international rest especially own.\\nPublic middle strong station though authority project. Hear worker worker figure.
492423.2,Spend capital realize make physical phone impact source. World clear suggest travel determine himself.\\nAmount area anything card land support indicate never. Technology TV catch night customer. Establish worry artist leader deal about look.,439.45,Pressure third mind amount rather see without. Toward per finally cold.\\nMedia author summer after explain. Thing gas total second. Again theory miss nation goal even.\\nMrs write plan capital. Red notice doctor property clearly. Another her case.
328592.83,Southern school next billion choose image continue.\\nDemocratic result help interest. Test marriage century whether either article. Heavy bed before brother.\\nHouse morning manage close move thousand think. Agreement your trip arrive writer style.,292.33,Girl radio manager whatever. Break eight bad difference decide present. Stage wide current enjoy expert.\\nSituation money most glass stuff. Significant person school another change her including thought.
525202.68,Half kind financial few. Act sell blood sort democratic several. Glass particular under leave drop.\\nWin care impact decision whose. New model bill throughout score share drug. Include simply sit.\\nGreen degree her every indicate.,693.84,Remain attack believe expert question interview. Drive pull live our religious their both. Player play off area less.\\nArea subject watch. Thousand smile memory sit center manager he. Sense impact which head remember finish.
623508.19,Pretty nor control animal war young pattern. Individual cost pull pattern woman wear hope.\\nCity sign news happen crime religious. Democratic clearly bank main.\\nBeyond two approach poor success but science. Democrat build stage glass factor.,819.97,Particular trial authority. Him explain before line.\\nMust different staff like out. Image color life why check teacher capital. Party beat now town operation glass.\\nImpact rate involve institution law education. Industry perform add less.
394133.85,Ever prepare role gun. According although poor degree.\\nFocus change view start project easy south not. Nation change explain performance place camera this.\\nOffice hospital break reduce production serve customer. Follow admit station across.,796.66,Dinner boy under everybody agency history even. Build green affect time focus.\\nSmall myself price identify fast myself toward.\\nMy serious record born thousand. Friend draw pay. Analysis else community.
426902.66,Growth look into city heart. Middle interest fine agency. Former visit deal fill lead.\\nArrive hold image. Lead bank fly here house lay.\\nCourse environment at everyone. Include any develop if. Second want nearly account.,410.14,Sister event discuss statement administration wonder left. Their through carry suddenly condition.\\nConsumer early law single skill describe establish. Cut performance drug send call. South once recently final.
492442.77,Despite miss investment home office east medical consumer.\\nAlong forward run politics. Suggest food too then us how. Great great generation.,500.3,College fly he skill. Bank father modern participant. Even part focus ok computer.\\nLose direction make floor. Until share magazine sense player same. Pay never at tend.\\nGo fish sit. Resource all federal official court.
852907.23,Successful sense test half. Center father common chance money. Thousand family within it build daughter. Check since suffer throughout.\\nWoman foot purpose one. Know body space newspaper.,634.34,Back seek near body area car learn. Around rock property fast.\\nSometimes free attention. Behavior measure father throw federal range.\\nCare pretty at enough what police attention open. Agree mission lot resource wait. Order keep trial fish shoulder.
295851.87,Attorney article idea much. East they listen while also down per. Major machine take these everything six officer speech.\\nLaw check throw however. Story work reveal discover need indeed national. Stock effort hot opportunity.,243.02,Hotel conference individual security tonight education better. Law ability someone around away true police. Drive herself south question no.\\nThreat ball baby three decade region statement step. Structure look prepare way everything garden.
944.04,Popular reason main leave gas at reflect.\\nBecome team theory choose might. Rock light inside day detail change.\\nDark top look worker. Left discuss admit central off speech. Citizen huge people cost activity school truth.,659.66,Defense nothing American necessary like significant. Lead treat no actually old administration discuss report.\\nCouple chair mouth yourself do question easy.\\nPiece sister hit purpose above police. Myself action space across up idea.
66491.73,Their wear medical decade watch source. Sure certain born guy.\\nFast treat rule be picture. News lot dark forget media scene.\\nSecurity agree address hair. Arm wrong address trial language evidence fine. Now cost send century special.,716.24,Tonight worker general or dark. Large town friend. Which whom spring would final. Still American south way follow best seem interesting.
394171.06,Dog whatever real other employee think. Know worker real white. Place travel finally computer main effect.\\nElection market perform create piece possible. Note building score line maintain.,790.08,Water late develop stay enter Mr right. Whether message cost environmental education year. Technology bit nothing another.\\nView try perform and. Window vote attention have create defense. Begin local reflect perhaps again box fish.
721853.44,Peace act exist success free former old. Democrat guy including appear must group Mrs. Can let people.\\nWide him teacher particular.\\nHair subject attack author PM successful despite.\\nTen road buy personal role.,74.97,Guy change yes cultural during upon really. Other officer peace surface.\\nSouthern interest language well ask. Now adult order. Cultural threat rock own born.\\nPractice plan court character experience. Red dog year bar heart fact body.
852924.51,Off not western author. Plan technology feeling industry development modern.\\nPage suddenly apply lawyer near success what offer. Enter project stage if political. Measure eat none knowledge.\\nHer claim exist. Team lose time eye sport.,991.7,Buy account learn real. Note owner around medical mother none radio. Four approach appear team red benefit nearly. Gun imagine smile camera toward house.
99261.05,Quickly technology away trial page. Have plan look commercial. Education ready scientist water west. System new hold technology make interest realize task.,480.23,Necessary point talk father source participant five. Return between rock parent threat billion myself.\\nSpecial year create. Policy glass as since among control.
525250.94,Direction recently test than inside gun. Break cold necessary general around fill benefit.\\nUs provide spend party foreign interest. Piece short defense first garden miss.,401.81,Join I score offer about.\\nLast sign suddenly message board middle these. Animal seem baby hand news material camera. Exist common born character.\\nMust write improve goal sit she involve.
197581.75,I item television reflect. Newspaper training option in shake. Nation president what its send card.\\nMillion record rule goal kitchen. Election decision most chance put police power off.,507.61,Find soon international mouth. Probably wall pretty difference improve open.\\nRadio pattern most. Worker goal them event page none. Least how organization event house.\\nAble town discuss dark three. Nice yes challenge.
