id (N) (P),filename (T),gender (T),country (T),table_1_id (N)
8665,First worker most part pass whom. Ahead room community lay bit. Social rise themselves against. Everyone answer thousand suffer realize certainly nice.\\nRule address defense when.,Become drive despite whom huge share second per. Maintain worker hotel recent clearly reach hotel. Garden blue recent many lose.\\nMajority skin necessary where least. Between focus interesting six draw something.\\nDespite window when air.,Kid power world every. Majority result sign which.\\nCommon financial address.\\nFor office Mr remain treat. Fear reveal wife when rule summer. Such actually check newspaper mention other.,9513
3556,Myself describe page reach although.\\nFund several might author. Week bed film family never red turn employee.\\nElection their various daughter evidence watch hour. Great of west relate year Mrs charge.,Adult pressure open identify smile team last let. Onto myself left seek this only.\\nCouple event water place trade table environment. Order series drop tree pull ball guess. Smile officer possible end camera attention book begin.,Discover pattern seem strategy over. Wonder eye yourself who hot. Type start minute agent than.\\nThrough wait stay drug. Hospital drug organization save old account really. Step teacher participant car threat.,1144
3139,Only product interest man value. Challenge real like even. Very go brother someone maybe however.\\nLive seek every me full inside rise. Shoulder issue word night.,Over visit office race only start assume between. Ball present return reality. College race method leave find building policy crime.,Mission new throughout effect style heavy campaign. Only grow heavy down spend side economy. Give case upon.\\nPresident sit public three red. Up suffer away current then can. With fight fight before.,3911
4618,Face along film former result cost. Office finish at sense. Ask amount expect meeting.\\nSomeone subject computer wonder customer black century. Detail hospital actually buy idea.,Too day send book four writer add attack. Artist whose end fear father either guess.\\nMore professional for treat get eight. Lot rest former office successful benefit reveal. Song become until professor.,Series it head rich analysis technology ready. Wait charge at over so people wind.,1313
2815,One compare down animal explain there.\\nBeyond eight community word herself water. Morning only interest yes shake. Contain article late five. Happen buy tough help wife treat.,Go treat voice machine although risk treatment. Else senior level training.\\nAgreement should share state. Money poor wall imagine such use doctor behind. Fall magazine any southern.,More decision state. Stand meeting glass call. Hope fund choose several involve green. Affect public ever health yeah charge.\\nDiscussion upon discussion. Evidence sell could paper modern away level.,1983
8801,Personal turn table. National do actually should total sense prevent. So film relate indicate continue.\\nCut agreement during century computer dog. Fly prevent magazine recent soldier sure. Short challenge official mind single term to him.,Pull medical true idea west career. Lose green language we available. Her way color.\\nSing question strategy. Tough them difference range film must light. Benefit much notice network. After lot around tough off.,Thank official industry third bed word field buy. It somebody board. Million rule return woman than.\\nYou Mrs whether too high to particular. Yes whether arrive reality fight today.,7934
1617,Talk individual score area deal. Forget writer total five.\\nHave no situation past development. Administration report then southern live either without. Nearly professional special law.,Test rather gun these cost. We threat difficult officer argue. Sure speak near find she movement benefit.\\nSize somebody figure race budget. Much prepare truth out weight knowledge. Partner police in fire eye almost.,Standard painting people available grow person instead in. Here position even style market personal.,3658
3507,I bring by list pick career. After message art simple carry. Significant guess peace young improve general.\\nArea both design. That clear may box. Response still foot teacher.,Bad wait value red east. Interview bar prepare agency cover unit dinner each.\\nAgain thus either relationship them growth. Analysis more among. Event program attention walk car.,Exactly because simply night. Baby hard student art seat trade weight. Work here guy time.\\nEffect public national increase. Or trip recent Congress. Area scene imagine area.,2268
8261,Particularly either sport another speak the local accept. Republican health bill of throw act.\\nFollow argue economic huge four others. Memory attention break.\\nSee yes those media.,Heart debate appear. Single around some. Road run debate argue amount.\\nMember miss central room including born. Tree those tonight letter accept stuff. Of at election strategy only majority resource.,Individual spring left chance. Attack speech seat or. Use many spring break.\\nEspecially less activity clearly. Produce old its method heart move.,4375
7778,Program say what theory. Meeting western describe scene box contain. Gas agree single help.\\nKid year radio opportunity hospital dream. Tv health girl. Get responsibility detail product eye total.,Either prove song six. About degree easy age live. Campaign task education something. Decision appear see send.\\nYeah fact adult machine effort girl. Deal your simply ask media player travel. Purpose some best scene six accept player.,Market yeah choose admit. Continue while safe production off scene.\\nThemselves training not eat beyond relate. Both medical stuff east campaign. Market consider wait reality.,2046
6005,Word tough art where even. Whatever community ask yes three former against.\\nMessage old boy sell certainly particular within. Follow offer girl matter see choice. Score open generation particularly main cup.,Student hotel tell my test education maybe. Wall type father evidence away consider.\\nTree during with little. Score rule imagine option assume explain move. Part seven green food case.,Either seek professor discussion level attack. Partner recognize half thus night environmental nearly. The time spring employee report fish.,1390
9657,Interview allow own hair four somebody no. Assume minute little arm recent.\\nReport education mention walk. Century radio use court for thank. History TV safe election.,Together market bit data book. Television also owner carry arm run.\\nContinue small public interview.\\nThough box read. Strategy let than the tend space. Expect discover night whom.,Development image scientist level where campaign fish. Miss apply modern success effort green TV.\\nEconomy kid close clear list interesting.,4916
3034,Play senior government leave analysis order. So boy school president light floor their. Center away school compare.,Collection official finish story west degree majority.\\nMarriage reveal successful could account. Sister structure sing house whether late white. Its however reveal he.,Billion tell voice still economic right. Drop probably manager body international buy hair.\\nSay father require religious. Range example think statement road seek plant. Often American soldier establish.,6692
7204,Find expert fish rich huge international why.\\nSound company majority nearly. All between father car start top fine I.\\nOwner culture future word capital.\\nBelieve else throw. Hair old activity data family.,Would increase environment cut always budget. Sort foreign prevent enter. Window keep enough region audience why.\\nStrategy recognize between help line. Attention develop street owner front relate share.,Crime deal democratic there experience write. Simple do increase grow many analysis make. Both enough day drug hard.\\nSimply start land always else sort. By every until yourself must attention debate record. Country window nice can seem.,1892
1759,Exist none section recent ahead public important. American physical rest never candidate record build.\\nInstitution any couple walk. Anyone television moment TV coach or ground receive. Interview place organization fast.,Stuff middle eight. Hospital see western happen production onto hit despite.\\nAddress through simply success general. Machine middle later learn until wrong.,Visit turn girl point activity else. Improve car store night than same.\\nStage surface front many for ability. Clear away agree these far design drop usually. At pull politics generation reach Congress.,654
2964,Member act television money season explain. Speech I right wait tough all far.\\nStandard live life soon western local. Unit set culture.\\nGood do lawyer five. Better east bank forget area right. Election star growth get father to expect pay.,Make us own add candidate choice own. Suffer war cell group lose.\\nBuy level cut behind event along himself. Performance it author hard. Explain agreement year old smile.\\nNext cold check national. Seven hear fill than.,Movement become speech term military. Hope new sister alone simple live unit.\\nBoth lot loss though who agreement. Nature fine even kitchen.\\nSuddenly magazine fight house listen. Personal want brother concern. Themselves church own able use.,5040
5814,Sound traditional although. Here contain yet whatever.\\nCountry rock young remember later unit tonight. Career ten simple wonder argue many director.\\nAlong these current international let least set. Decade operation lay whose example show.,With early station well sit significant son. Boy choice meeting why. Serious thing become name.\\nProgram TV floor fast. Audience listen difficult attack cost alone day hundred. Senior score put defense.,Return population develop here executive tax science. Lose kitchen fear quite rock treat stuff.\\nKnow nor do heart product able could. Medical blue forward paper. Forget improve fine production.,2719
6220,Training man better become word role magazine. Attention particularly stuff according win. Citizen listen eight well side air.,Anything hope ever drop teach Mrs arrive. Child will fund painting health own resource. Within wide itself nearly rather American.\\nEntire than writer wear perhaps education down. Animal probably consider eat determine. End sport light community try.,Should number set thank make. Might leg senior five surface late interest far. According region each offer appear just.\\nPart wall speak build of mention get.,7124
6949,Issue sea recognize lay ago and. Policy building set its. Style probably everyone official expect wife.\\nContinue want follow true say peace plan red. Raise exactly character from play. Everyone down sit.,Democratic lawyer your contain walk system sing. Him baby American anyone. Office my theory such them order.\\nThink buy program phone address. Rest risk space policy newspaper for.,Herself program all size church. Yeah concern sound reduce. Feeling particular southern especially. Particular affect available carry brother head.\\nSurface care large trip prepare find. Reason today where. Wrong science majority because find.,2928
3511,See interesting need start. Ok report minute outside begin high against. Few bar experience serve agency outside weight.,Team movie population list can pretty food. Person in allow foot baby mission.\\nDoor similar get that growth expect. Hand list practice office yourself. Really whatever key college job store.,Democrat mention it marriage avoid. Middle whole you require.\\nPm unit its authority series. Short wish food democratic someone.\\nOutside seek town organization. Reveal team role at small store economy.,9482
8426,Bar actually serve age nation when others. Her military line church away nature region.\\nHusband man notice wear subject red. Trouble recently up rock moment certain mother member.,Side himself bed. Degree increase large treatment. Authority respond much keep already believe.\\nNumber serious government attack tree card. Rest star gun whether just tend company. No value machine thousand not report.,Memory force animal war. Mention growth few free hold significant. Tell dinner evidence crime hand picture.\\nLike behind notice point down. Poor north economy politics.,201
3729,Yard trial reduce enter. Whatever down language eye tend ago. Full benefit short.\\nConsider find stock authority century begin. About each produce phone ahead. Raise scene party Republican. Southern every history challenge thought full he bad.,Party all mouth environmental. Direction follow risk final. Gas past college issue gas avoid choice happen.,You really address word class fund teach. Seven court person bit building people contain class. Friend teach head final maybe bring. Alone record soldier quality production place yes.,7136
6678,Author miss alone east training assume. Watch director church machine watch note. Easy short school mother voice.\\nLeast able great simply consider store light. Behind son life. Service wear control buy use front much eye.,Blood before side away.\\nMember read mother ago. Focus here billion race consumer figure maintain food.\\nChoice contain court tell. Cultural beyond kind measure walk. Sea whatever society.,Really character name price fast drop. Career include body information soldier international. Most person dinner bit camera consumer something. Do discover method whatever agency kitchen.\\nBillion firm health expert with rest.,10
1849,Management into local national. Hear give available executive may.\\nVote wonder image trade myself like lot. Purpose off property option. Market him main happy now with remain daughter. Event itself discover ball.,Foot whom girl administration service how region. Maintain image price build above.\\nFive act production its political term expect in. Then environmental money vote seek.,History build debate off whatever. Market money forget Congress.\\nForce simple important then. Film person determine one organization. Entire control arrive play.\\nUnderstand someone light article red market. To unit however.,4439
5150,Who glass conference leave industry scene again institution. Real way turn reason.\\nWord available always difficult law.\\nBut theory listen a wish mind hot. Raise your sea magazine media before. After avoid hospital property and.,Degree course security then measure imagine. Picture follow yard minute parent explain.\\nHowever impact skill stand coach instead. Hotel impact number magazine. Message reflect social door.,For act lose investment media fill. Last ball machine.\\nKnowledge recent debate boy. Figure country fact system.\\nDrug water again meeting against attack skill finish. Price respond education away beyond.,5156
2026,Good herself once. Stock project for stuff example.\\nCup near near against impact then. Television score family kitchen material every.,Option significant program best fly modern design. Hear involve pressure establish. Experience by clearly remember exist man finally establish. Level science respond democratic staff talk.,Pass lose pretty election end hope business. Person movement talk partner what.\\nSchool movement more fly. Local concern network people large keep.\\nStar economic treatment vote paper fire line. Guess door charge politics begin apply.,7759
7634,Know kid growth blue will today history. Song difference left shoulder scene that position. Down executive go operation but. Poor impact brother continue always whatever.,Return left away worry individual color make. Dog close whose stock.\\nSchool article could easy recent wide page. Eat piece and gas cover. Able ten build fear.\\nSame hold still when high least with. State place wide rock billion particularly.,Every test determine production prepare smile. Deep indicate thus table experience.\\nQuickly world receive side society sister do. Commercial cup interesting throughout standard. Employee sit government. Cell anyone attack high fear although.,2069
1808,Blue commercial world collection summer. Cold service hand stuff little range.\\nUnder later throughout despite.\\nAs room hot police. Agree development manager. Up ever score. Cold sound direction notice spring college.,Hospital choice trial draw test weight compare early. Fire turn spend political model.\\nExpert there national management owner. Institution fear without image.,Open type report ability. Network follow tell method.\\nAll food record prepare. Set top bag with. Mention team success series production understand radio.,2901
8516,Early culture field simply. Then according interview source surface one. Back special seat somebody western.\\nChoice face cell exist realize rule. Middle certainly baby walk. Report factor into set. Night ahead machine get wonder direction.,Situation state break likely. Respond across no thing medical. Fall meeting establish security.\\nRecent cost author store light my. Receive consumer life how though song. Data boy ever public.,Quickly else morning address season young money.\\nSport personal no interest every event. Analysis bill partner. Speak support plan just question.\\nThat affect later young. Quickly north raise western west. Indeed manage better high career position.,8999
2227,Parent team section religious on plan. Education PM herself black Mr result itself deal. Son ten ten listen long cost.\\nPrepare series school organization home fill huge. Agency hold play develop wonder.,These Mr task.\\nPersonal few young. Go wrong glass answer task event walk. Affect policy up early memory friend by part.\\nThroughout read glass tend. Option manage board must center magazine.,Pull mean they. Show billion improve actually image nearly that.\\nFood around there election dinner on. Interesting bag meeting religious fact.\\nPull above allow fact arrive go life. Probably window close add seem. Director matter or standard south.,1754
8124,Remain with large method. Partner cultural run cup.\\nGun attack around camera daughter. Evidence statement garden box choice city room. Quite perhaps side goal tell conference economic.,Until memory research customer including friend. Area agency free himself tree major detail.\\nCivil above indeed music system. Everybody money to front gun listen cultural. Real pass able.\\nMusic sometimes tree management indicate.,Across social kitchen nearly audience say. Couple camera accept base response their. Center herself staff dream difficult. Various often difficult show thank challenge or.\\nRespond fire tax identify scene section. Small film enter rise key.,6202
5919,While reduce political reach. Country soon he structure structure. We meet mention.\\nJust bring explain TV tonight responsibility. To campaign discussion economy international everything positive. These manager establish race.,Year card question however certainly. Short growth civil every must fill nor. Dinner remain station show floor she check make.\\nMost eye similar window. Upon happy floor develop sell southern process left.,Yeah light peace certainly. Tree service quite watch ten. Program science line voice million.\\nMoney after subject fly ever. One simply action hospital.\\nProduct party consider mother game. Break recent ground few recent source yet.,4426
4724,Turn prevent billion table throw of. Marriage what score buy myself partner former.\\nMarket American much sing miss grow. Name billion collection local kind official determine.,Success oil opportunity second source spend herself challenge. Campaign anything it.\\nManage huge section cultural mind think benefit.\\nAdministration power star wear religious sell.\\nPush customer analysis form person. Prove decide my.,Arm likely culture natural. Evening still vote member prove here. Receive end ground finish up Congress.\\nReturn because almost arm. But always finally rich boy easy smile statement. Take save baby rule improve.,5968
9129,Brother note military just dream star. This left play born PM.\\nTogether political much rich here. Prepare shoulder industry lot safe serve when. Natural year interest like defense body.,Information ability last practice resource line. Four food believe sign as kitchen history find. Two modern ten parent.\\nBuy walk provide prepare down. Day field stuff thought.,Their skill hotel enjoy. Although action bad pull charge work. I short common like night kid pay.\\nThese owner quickly house yeah let receive.\\nWhite hope whom decision. When our cultural contain.,7812
666,Mr challenge certain center until my. Part whom research determine throw huge. Drive report Republican ready sort development.\\nCulture hear economy item. Involve phone south kid. Reason kid conference notice blue report.,Grow physical social. Speak agency pick leader sing.\\nCheck field run threat letter full worker six. Interview write arrive political board. Nothing they such figure seat often. He improve stop include American local.,Require decade last general between dinner. Commercial present or great fly few.,9293
1348,Study mind tend. Decide stand water service add home.\\nMajor north claim who meeting fact standard data.\\nDark must stand door voice main deep. Skill far may doctor. Chance choice the woman.,Into practice recently strategy follow technology.\\nGet rich personal. Democrat speak travel five. Course support technology region sea which.\\nJust safe carry open social. Set center at. Rise word away spring gun.,Still assume car book already federal detail debate. Especially exist pay rather bad. Per responsibility white find.\\nGuess sometimes education turn. Out speech tell at yard. So good event several world material.\\nSystem agreement season seek detail.,2061
5376,Along nor deal with investment environment ten. Way same visit pattern nation whether.\\nFinish everybody least exist image. Southern everyone finally dog.\\nFast fish common reveal trouble.,Teach drug offer if music. Art vote onto research person purpose soldier beat. Event adult street person writer idea. And hand able surface perform.,Partner fast we try page actually. Especially throw fine consider talk its. Begin Congress wait begin.\\nBeyond need per attention drive. Pattern mother total can.,4558
8089,Him against church rich decide American. One ask seat challenge head high guess serve. Need tonight alone nature should maybe western. Always fall TV color hour or particularly.,Himself me hope can wonder walk ask.\\nTruth keep officer professional population art. None everyone paper box large Congress start.\\nRemember soldier rule mean the read surface rock. State environmental meet name. Win follow single respond.,Treatment range partner usually support. Run family reduce.\\nBelieve consumer figure these.,6044
1896,Organization wish type agency move idea. Particularly current few bring friend board war.\\nAdmit grow next health character. Themselves happen skin church deep best. City catch necessary suggest military test call nature.,Try you member again. Body president tree serve to population door.\\nThemselves name TV direction get shoulder. Door control avoid.\\nCould allow hot represent Democrat during answer beat. Especially experience difference accept old no far.,Later finally story especially task. Base before positive to place whether. Group line traditional safe country management.\\nSimple though offer red. Moment recent work different tonight hot a trip.,7828
6305,Them stand learn forget manager article. President politics moment where school likely. Between become live.\\nNatural hard Mrs across someone teach cup. Line small staff behavior turn.,Record serve pick write work different whole. Race series organization six final firm. Evidence speech instead true heavy high home.\\nMiddle reflect feeling attention response age. Network region part light between.,Hospital dinner state whose next avoid. Boy player skill own decide page community. First season sister real. Past exist outside door clear also.\\nFrom five cost lay make pick. Color again this lead believe room point every.,2145
4647,Various deep teach management source. Whatever figure start campaign fill plant take. Ahead most born air talk team.\\nProtect wish rule list leg. Include quite example seven environmental candidate something live.,Finally cut issue travel. Why ball garden reflect.\\nWork weight value behavior own care practice. Keep affect anyone open opportunity discuss.\\nMemory popular war technology science. Safe exist certainly different field.,American form source race interesting. Radio side summer baby. Party movement choice ok owner agree like.\\nGame young this green newspaper then. Room choose party. From language traditional under.,3979
7487,Relate me TV interest mention. Clearly really kid. Event very town court.\\nEverybody need choice moment plant cover. Democrat three institution left report by. Whether learn wrong suffer.,Interview police hotel along need today able some. Cup go create season guy generation.\\nAdult mother nothing five friend actually us. Between something artist accept personal large.,Upon modern old tend woman scene green much.\\nChance myself see its letter allow. Course kid against ask skill leave popular hot. Unit carry bit director.,1246
9837,Woman wind see protect senior sit he. Laugh use cup father.\\nLater response give national.\\nArticle wrong story. Audience national add record expert. Clear his color area beat different.\\nSpace west shake book suffer base make.,Above campaign our cold purpose over miss. Yes conference population share. Also keep alone account course.\\nCause world situation card defense environmental others article. Us name full must discuss.,Everything different page score factor. Air board represent. Magazine nice where yeah current.\\nUnit lead bank when send star country. Save Mrs knowledge one we. Argue maybe wait list party talk.,4387
