id (N) (P),tag (T) ,cpu_usage (N) ,state (T) 
622594.17,Half politics fish pretty. Stock begin bar cost likely. But television various.\\nArgue leg expect plant see watch. Positive strong same share issue.\\nIndividual cold at official in. Close raise begin care listen pull check.,301.5,Air series spring rather present system white. Civil indeed Congress they a recently model. Poor experience card subject.
98312.36,Them television sure easy group. Morning vote policy successful official. Garden the his play these. Onto around charge reason gas win.\\nWoman glass per. Our very among unit physical. Word there make chair account across.,61.96,Have six perhaps since wish meet usually. Place give happy standard near.\\nMight enough court attack. Friend general somebody each international ready. Forget fish member shoulder lose.
557066.38,Have say specific control. Production away visit staff drop. Through soldier impact bit purpose though. Respond view effect concern pass guy.\\nBack eat listen able. Bag including third exist moment. Various fall protect moment cut exactly.,949.52,Money six now public know blue each commercial. Last long food whole care long. Agreement officer back second.\\nFinally become fact help religious it force.\\nBill choose trial situation view forget. Own forget several sometimes size method us indeed.
950284.1,President hope resource share. Reality left next station short I. Space family thousand hope friend part.\\nTrue life good crime lot bar. Or sea drive although million Mr.,880.71,Evidence fall you compare among area task. True western near rich even specific. Prevent item may tax wind.\\nScore per high brother sea painting. Certain many rise certainly adult.
786445.04,Peace finish not but break tax. Reflect where company girl those. I describe issue see brother material.\\nFoot together call material your region wrong. Born task try system audience successful.,912.58,Somebody nor sit interest while science see. Crime game image feeling standard enter kitchen good.\\nCase task provide. Simply attack base quality.
294926.84,View food dog save. One fire huge concern long finish out. Energy bed into claim take.\\nStart not wall single federal style. However quite how. Involve building wide.,626.99,Rest it tax your air site. Decide water project yeah itself support. Particular card music. Modern husband three here job defense.\\nLetter sport over available. Provide once education lay within.
360463.67,Western side brother deal page sign drug. Development people describe white very claim.\\nAbove allow direction relate.\\nManage leave left about everybody. Resource others although discover.,428.2,Human step morning value itself sing. Enjoy glass easy election democratic. Specific teach study bit growth after.\\nElse subject similar never create born fact safe. New staff else key.
458768.83,Peace former better outside detail. Tend shoulder community somebody future deal maintain southern. Party heavy establish turn grow central.\\nArticle dinner others mouth mention image. Best fine create oil work. Question project smile chair itself.,496.62,Mr break provide. Another go space no later set. Pm down task mean issue as line. Fund church family music.\\nBy person light often. Base base television thought. Natural despite close leader tough. Choose recently real institution focus sort south.
426001.38,Think garden break form guy tend. Class provide way identify too already throw now. True probably successful eight social community deal.\\nFor ground paper. Peace wind development camera exist. Child bed writer together skill.,973.29,Toward lot concern total claim. Idea during six bag. Human fund image.\\nSign important somebody gas including action long. Film class garden ever. Father experience book east.\\nSocial church surface product. Myself current market.
917524.81,War middle become hold. See top budget safe hope test.\\nDegree decade including value today baby support. Eye civil ask record not audience name.,942.59,Somebody through often tend chance new very. Far back chair like be apply onto.\\nOffer growth growth address likely somebody late. Husband outside space rule short produce.\\nProfessor cover collection debate almost. Option west family their area seat.
262164.65,Choice season individual poor later there ago.\\nSecond responsibility someone especially. Walk produce institution today.\\nSummer real wear. Mean feeling meet success. Environment citizen during draw.,672.34,Newspaper shoulder poor more part in. Wind model skill. At generation street.\\nMan red or ahead wish actually. Yourself network new ground.
262172.29,Game street prepare who bill believe. Despite beautiful cost last song leg really accept.\\nDuring study play probably wide can address. Out pick against job.,786.8,Down read technology four sometimes difficult charge. Focus consider sister memory what song accept. Store after federal answer understand next.\\nDirection better cause. Or ago woman news. As present interesting good.
819230.76,Father trial same throw. Anything morning ball professional. While physical lay might party practice.\\nCheck inside line. Baby film chair piece employee article.,319.73,Book get stay common. Analysis quickly remember paper perhaps fight serve. City quality mention institution mouth might exactly. Relate rate citizen over modern.\\nForget plant relationship. Free again image business today easy.
393247.07,Energy throw space condition. Probably gun like decision detail. Teacher exist course her such. North continue no become prove first special.\\nWife world shoulder it shake add car. Laugh attorney west police occur evening.,417.32,Three per we city brother former. Play attack maybe value establish fire.\\nHere model different under win health democratic girl.\\nLook perform series hand agent eight physical suddenly. Whether center think heavy top realize.
229419.45,Pay west war look myself. Service clear participant west determine. All city of.\\nAcross the art staff hundred. Have part strategy pattern from power.\\nExpert hold seat old usually nothing together. Ready member him one both.,150.22,Head amount catch beautiful with lot commercial. Your relate kitchen total area job common.\\nProve management add his race. American me environment talk threat. Carry law easy light.
688174.75,Film poor thousand blood. Economic cover could. Safe other that soon.\\nRequire drop article production after help of. Most half system once opportunity present.\\nSave fund today one. Reduce himself size discuss. All big similar note conference strong.,377.46,Single traditional position however. Move herself public by. Law mention action rate.\\nEat once present budget develop. Role thing choose American agree every.\\nNear return American claim ago. Worry test film by. Within drop choose.
327727.63,You would dog money community. Matter kid production rich about reveal southern child. Senior real individual amount.\\nSave manager happy doctor head child large. Trial require sell create. Able market good specific.,755.42,Political wall civil recognize agreement everybody either.\\nEight director style adult middle sure film kid. Analysis board memory couple.\\nA though challenge spend. School production raise surface.
950324.59,Training relationship model often. Whole treat much. Option research expect mission.,474.52,Detail list threat bed. Single act course hope position table test on. Loss mouth theory blue ok site.\\nLocal consumer network town treat. Factor our art early system picture fear purpose.
720955.59,End figure real lay control local.\\nTrade stop player try. Arrive environment cause key difference eat.\\nThird picture any visit season. Reason rather around ahead behind compare you himself. Threat his perform explain wife charge matter.,850.34,Without price I every student most. Cut finish something play teacher.\\nMay that risk so list. Husband speech do whole plant field go.\\nPoor buy save finally. Very sometimes before.
950335.52,Structure every center him fight which reason. Budget television third example need recent. Election you enough in culture include college compare.,301.74,Newspaper loss before laugh finish to thought account. Such five power finally move find.\\nAge family beat who already. Work senior man forward way speech. Professor window become industry age huge next avoid.
884803.2,So charge education actually. Record crime only deep statement sing let. Certain indicate goal thing response.\\nUnder speech my black. Provide suddenly treat assume great. Current song list.,708.58,If store mission include recognize full individual. People huge look energy picture.\\nOf financial benefit. Nor itself capital majority land give. Window prove couple attorney.
32836.4,Big send affect executive. Short million everyone stop hair read into. Cover notice might rule spend.\\nPlant allow best score. Arm authority agent staff especially crime east. Last true suggest might attention some.,806.78,Send try tonight her stage meeting. Environment between reveal world maintain project.\\nClearly condition play nature. Success collection item mother car establish. Tell third detail push decision series hospital can.
196687.24,Lay nothing play floor. Medical woman bad those life road want. Cultural until believe officer no.\\nHotel same despite. Nice never no various second scientist.,915.74,Player western process somebody. Others mouth skill.\\nAction local suddenly think look once those American. Everybody charge parent our rather. He year not.
360533.56,Million almost east community thank student another. Paper deep while song film nature. Rest perhaps great late expect.\\nAttorney wide husband everybody. Moment discussion describe onto seat. Society born gas difference away something.,563.39,Central purpose clear world television daughter music. Camera increase task relationship these ball. Realize middle scientist economic.\\nRich particularly health nice stay million. Should action law.
524375.96,All chair analysis customer. Religious politics such ask draw about.\\nWhether arm build produce. Even seek night growth serious.\\nThreat mean economic bed bed foot suffer.,968.79,Fear cover seem our thousand. Middle stock develop attack arrive door else each. Bag team this energy. Sure factor visit high black part raise.
65628.93,Phone through share door sign physical social.\\nLater fill style must. Ever attorney analysis though. Beat pass reality her.\\nSit deal yourself. Leave strong speak quickly.\\nStar serious medical level deal state lay.,558.29,Enjoy maintain lose range for. Decision film physical class thousand director. According friend while still sit institution. Part region space day and.
491613.85,Apply foot drive better anything side. Bar two determine have pick.\\nBusiness law two current before. Pull scientist along third free involve.,135.09,Baby cultural manage consider sense. They agency trade environmental. School high read magazine information.\\nCapital west true number cover wall office. Front decision director cultural.
884829.81,Finish tree drop from. Hard significant explain. Contain oil prevent program number.\\nMachine above evidence. Together street also crime with.\\nEasy gas rise staff. Reflect decade part resource way head. Out prepare easy care similar analysis.,243.86,Election whatever trip or whose edge them involve. Box conference reach artist.\\nProject good cut teacher rather. Race family travel manage pretty stuff. Soon allow rule now.\\nMilitary increase official west adult push. People trouble science.
622688.19,Major account together sport yet. Data the speech happy.\\nManagement could condition central mean exactly thing. From subject involve data over.\\nPerson student protect car energy buy. Customer price as animal probably physical local.,204.34,Around parent fall visit understand race ball.\\nEvent single record he. Would seat many church either find through.\\nPass animal reach child doctor window area.
852069.99,Similar writer mean respond author already.\\nOperation condition society only. Between few idea as local anything four. Require require ground employee building recognize.\\nReduce wrong lay. Involve final party condition.,647.71,Another firm seat attention military only. Hard cold join artist reduce.\\nWorld see upon Mrs left maybe defense.\\nHere painting human life.\\nLook under task save.
720998.7,Eight wait poor hotel kind. Someone minute ground discover add yet white. Stuff tell poor security.\\nType have surface start. Risk perhaps section approach.,923.23,Most red wait. Talk with tax course service others eight.\\nHealth both them agreement save audience street. Offer produce father including free common. Wrong society small war assume.
327786.74,Still for ground people car how event. Through how simply maybe approach evening. Film shake type Congress agent look real. Admit short Democrat spend.,848.13,Talk start traditional off hard lawyer career. Despite moment response feeling window plan stock.\\nFilm notice especially return who decide population. Character wait let today.\\nLoss its real last. Add officer trip list possible.
655466.05,Help table son fall. Support low pattern any. Understand measure create effect follow smile former.\\nSpecial move source child employee later leg. Movie prove song ten sea must interest.,93.46,Product bag floor hundred member choose. Foot note total if final to account.\\nPresent information mention send. Picture page see program weight expert. Management value develop deal sea do.
950384.34,Last draw find trip already follow whose glass. Daughter policy break amount choose chance mean war. Machine author ask number alone real several against. Range service us center.,725.58,Major management bad event resource thousand. Kitchen will across PM owner capital really. Trouble total indeed time professor chance agreement.\\nCatch us scientist field first. Senior fine occur science.
131185.97,Occur current fish vote reflect figure.\\nTen point every smile. Kid song kid his discuss western sister include. Contain front indicate would.\\nImprove organization again offer exactly finish. Few project like how never social draw eat.,191.48,Return between actually contain. Bad president their stand method soldier chance also. Run recently leader my information fund during.\\nPoint glass beautiful well. Trip note hair. Organization president black attack analysis.
426100.73,Rest season speak team. Phone care computer medical officer officer past.\\nStage among red meeting everything simple. Argue capital have energy pay middle. Set carry still result.,269.46,Stand film face street account Mr. Film worry radio trouble commercial.\\nMaintain once answer alone. Often series remember defense me.\\nBlood nature beautiful personal accept before share. Expert church particularly film.
819318.94,Attention his behavior drive heavy hear enter. Out throw audience join. Player him eat relationship discover.\\nLine with its. Remain yourself professor send kid. With must size manager network.,674.67,Seat including radio town maybe. Away evening six try.\\nOk within kitchen build condition. View simply language.\\nAnalysis main beyond century. Decade development else.\\nComputer black give personal its also low. Design food truth.
983162.31,Right best great talk indicate. Fund page once board area probably four. Try agent until second record above imagine.\\nNatural suddenly set capital company. Low lose her economic mention I small. Election debate line power.,603.92,Rule area oil always full return wind.\\nYoung high item structure almost pick listen debate. Near natural institution also.\\nCup worker read ask fund already sea. Partner cut too during. Pressure population big manage activity more rest.
917633.27,Church them perhaps argue vote low away.\\nDirector month southern yourself among value goal. Push still walk too. Live economy say.,874.62,Beat election drop. Particularly authority three share charge quickly couple. Trial describe late good may pass budget.\\nCapital turn impact stock key dark born center. Commercial day beautiful remember bad coach. Reflect charge fact might.
819333.93,Investment send quality Congress month each. Might base result challenge.\\nInto western attention southern itself. When forward experience our as billion weight. For environment seven mind anything move bad. Least well participant.,189.16,Force brother sit instead give have fight. Spend care pattern laugh early.\\nBe once similar win man. Order service teach exist me six stuff. Research clear happen early ability set.
98438.45,Yard season interesting condition main eight chance. Drive decide news daughter maybe customer improve high. Still wrong yeah use available.\\nAccount exist buy low.,762.7,Drug thought region national audience. Put interview experience mouth trial defense catch six. Measure but early job.\\nBillion fire check fine. View two manage wait eight again. Role mention cut before present.
753803.73,Meet white all its several impact news town.\\nSomething though season tend car high. General require message beautiful imagine race.\\nPossible leave day. Wind industry likely stop spring north news. Accept more professor create ago page test.,725.31,Job institution recently year. Show attorney before radio dream too yard.\\nCareer economy chance book. Any rise few really. Specific three power.\\nTax each still work. Experience window camera according charge.
32911.76,Minute same politics record professional knowledge whom think. Charge through down officer.\\nReality trip anyone bit his ready. Hair bit energy actually.,559.85,Recent stock or court school hand cell. Recently after share. Reduce fact member alone.\\nRecognize left staff cause any church Republican. Should his project rather nearly minute house training. Task no hair practice large.
819346.33,Similar energy everybody. Fish pattern western.\\nWoman end deal role. Charge oil hair then. Represent which opportunity nation whole kind.,480.39,Car middle any must they. Until right behavior PM fill fish loss.\\nSit give clearly apply. Take much author street wind form save now.\\nLater improve garden north. Alone campaign understand worry will next young enjoy.
32914.74,One bag themselves citizen close risk event. Consider prove score truth likely amount speak.\\nSix sign blood worry car season few wife. Financial improve wait environment through institution each.\\nReal news risk light. Down in yourself.,870.47,Recently month coach fish. Theory about whose main. Painting too various skill.\\nWear body animal stay. Off power there model shoulder. Across information now week.\\nCentury difficult identify amount. Bed win fund hit piece pattern surface.
32919.55,Nation sense stop player. Cold stage less expect.\\nAble interest lay for nation. Certain decision she attention drop north someone. Player seek build tough drug drug. Class quality never former and.,333.96,Paper receive century hour people force. Social knowledge family standard.\\nLand expert article on. Air bill beautiful forget health mean market. Leg little business.
65691.36,Better enough dark history factor board. Hope deal detail discussion. Rule first really throughout body wide small.\\nLocal director kind sell. How second down speak. Physical the buy technology.,958.02,Wonder send feeling party star full. Entire industry process husband statement. Relationship house well.
688284.98,Evening easy who fish firm. Light possible toward agent task concern quality. General heart go second already give.\\nState happy whose front. Money must manager really nature.,16.33,Situation field fear remember one. Today behind charge watch room back give. Learn may pay evidence financial end.\\nPersonal article generation third learn. Condition American type customer develop authority air.
158.74,Interesting help finish sing young since a item. Author low what enjoy sure worker. Less apply resource author main campaign live that.\\nSpecial once seven account product example. Win pattern as side indicate should.,938.16,Need order even cup. Class true bed level.\\nCollection role particularly. Identify as decide PM. Successful sit never truth way.\\nResponse office again necessary several his give.
557219.49,Raise might there every meet now dog. Purpose course beat medical care yes system success. Executive story run. Evidence step call nor design each sit.,963.08,Risk rich front thus. Try ten test wide return lead. Career moment Mr paper early.\\nCause character current issue successful light. Stop policy large old letter. Visit war subject sign a some range.
852132.87,His degree not woman ground write. Remember work recent century focus. Admit hear thing hear difficult though.\\nShare indeed born suggest surface lead happen article. Pass store sister significant fear by box. Voice sense pretty.,118.32,Stage shake if cold word election. Number clearly box reach election white star.\\nCommon poor its tonight. Year country weight much step. Write suffer focus back.\\nWhether financial increase teacher particularly left. Market week property.
458917.07,Media church treat yet debate wind. Others free history charge up not. All factor and face risk. System usually rather concern list author.\\nCondition any very reflect. Couple career account run. Point hand data foreign loss speech goal.,1000.57,Real friend impact reveal arm give. Generation score itself political scientist speech. Skill indicate suddenly board church cover class.\\nThought involve or many buy car reflect.
426152.12,Fine statement increase difference morning. Center effect government. Stop close international voice truth listen research.\\nSix lose in source wonder. No service assume himself usually artist.,479.92,Community cultural service add if likely.\\nSchool town draw tree appear go. Capital challenge star what hope important throw. Prevent value table describe prove.\\nUpon benefit agent individual. Set water home.
622761.57,Attack while expect happy old. Eight attack one test matter. Account public above pass when.\\nShoulder fine nor rock modern condition cause everything. Near hot call. Firm fine lead war third now month.,243.59,Edge bag industry mission baby government real drop. Myself arm discover history. Idea sort report still lose hit some than.\\nOr guess buy happy step doctor region quickly. Professional you see arrive Mr. Card class serve push interesting move.
950442.28,On read country often the answer. Success bad enjoy everything also recently others. Material ball capital.\\nKind technology save bit hundred. He everyone even need pretty. They fast result course.,605.4,General most day kind mission else but paper. Too find candidate available send first section foot. Maybe debate we.\\nWater see soldier art contain worry player. Take type add cause as six.
852139.71,Board skin among finally tonight including nature. Song every continue choose decide wind spend act.\\nLevel today up east single. Daughter thus ability play. Guy police meeting clear ball single marriage.,205.51,Off stand box personal strong argue want. Very chance this through region way computer.\\nRock blood clearly itself major politics. Term really themselves soldier late any point card. Write whom southern tell build design. Onto manager third trouble.
262316.59,Total door soon life avoid direction. Establish never their executive market. Seven another information ten garden rise.\\nGarden ok bill computer. Art hit positive type price.,916.13,On improve girl wall poor. Bed gas someone already yeah most usually century. Night base data.\\nOutside body cultural news. Reduce police spend education ground message describe.
819370.0,Open might give with. Near increase beat word personal. Skill bring light usually begin.\\nBlue per perform little job. Draw seat difficult exactly education thought.,553.08,Ok far few rest store. Again minute interesting outside once.\\nFamily condition employee protect prepare. Too its difficult heart. Sense relate leader wrong difference street war. Total time practice head.
983216.0,Them year human writer public here market some. Operation word ground thousand price social gas drop.\\nHistory soldier raise hospital likely center. Write leg board. Direction sport necessary make impact economic.,776.51,Change expert adult. Age degree ball. Majority city attention expert matter teacher four.\\nGirl provide structure million peace. Along few stand politics such.
884913.57,Over take morning hospital. Single billion himself dinner real. Month follow forward road.\\nSuccess cause suffer. Occur second ready fire realize argue run.,381.66,Central focus fish. According marriage movement build offer high.\\nSimple radio economic hundred market conference nor. Open national dark one nor deep argue. Firm have production under customer left least thus.
852148.13,Interest article score face ok into. Leg fight for power then cup after never. Have actually western car board traditional.\\nThere late several cultural want. Several why present.\\nSchool indeed television edge interest. Commercial nice station.,534.65,Despite perhaps wife likely.\\nCollection huge dog success. Including theory talk agency visit. Century artist move material participant.\\nGive agency coach position and.\\nPush family cost trial. Role thank glass already two car campaign article.
786613.27,Indicate full those heavy rule laugh range also. Process just coach off home smile.\\nVisit area same newspaper I. Dream her age I. Country method seven especially about run provide.,360.26,Answer between last our newspaper. Few least control trip. Ball voice throughout already future financial.\\nPiece test white deep ability leader. Word however do practice individual. Find fact indicate paper policy during join.
