id (N) (P),last_modified (D),title (T),updated_at (D),table_1_id (N)
25,2007-02-09 13:29:39,Guess state third memory. Item space past not. This name key knowledge morning authority.\\nLot pick it agreement professor. Million life paper party those.,2009-10-31 06:49:57,29
91,2012-03-19 23:09:23,East test society manage student position the. Of feeling budget up require.\\nWalk approach main worker something. Notice how beautiful low television cover. Eye compare we relationship.,2019-08-23 11:18:00,18
9,2011-03-15 21:42:28,Hair collection tell rich. Small there particularly shake face. Often nice laugh.\\nProfessional study history key fear but. Other audience somebody value American add close study.,2009-08-21 07:34:11,12
6,2019-04-01 01:47:16,Many scientist former option. Long cause draw garden pull.\\nPer Republican young serious night particular.\\nCentury visit become language science mother product. Remember under quickly early quite bed now.,2021-09-24 19:30:32,36
85,2015-11-11 21:13:10,Fact figure bit place offer structure. Pay but stop nation dog official.\\nEach already success high let last. Old wall car choice may. Less start fill choice notice.\\nCenter same drive walk point such bar. Great home which certainly family.,2007-06-08 12:25:43,29
30,2012-05-25 18:31:01,Certain physical especially part local per agency. Test lot single hear.\\nLetter office explain investment marriage. Common away lawyer election heart if.,2010-10-16 08:54:06,87
99,2023-09-17 20:08:20,Require nice glass capital social. Medical deal friend even second.\\nEverything source or already. Need way agent really game style. Maybe hot current option.,2020-05-11 13:30:15,70
38,2016-06-16 06:52:02,Involve consumer rock great will daughter create. Live perform add week.\\nAmong town paper certain. Doctor already tell group.\\nHair anything even figure feeling fact degree. Effect for lot. Three include consider traditional magazine air.,2016-07-02 06:44:11,87
11,2016-06-16 06:52:02,Available senior nice town actually check. Action accept total general effect.\\nCan discussion service all. Audience run across personal many read. Whose quickly start yet.,2017-08-03 16:52:27,95
13,2016-06-16 06:52:02,Simple degree market someone study goal quality. Impact box all. Budget hot ball itself range travel.\\nSound fight decide. Somebody per expect expert attorney number way. Both song majority just in.,2006-11-04 11:30:43,87
