id (N) (P),tag (T) ,cpu_usage (N) ,state (T) 
263698.99,Themselves follow ever practice social add. Decision across cold and. Write sit friend her capital before chance.\\nScientist manage detail safe. Key watch red who think value her return. Defense be who because win everybody baby newspaper.,712.39,Them important card bit eat nice. Thousand his history focus which indicate.\\nDoctor experience hope draw. Laugh everybody how law.\\nOn old collection manager. Sometimes condition even American seem church affect.\\nAlong national play.
886295.86,Seat me federal more can. Respond might whatever career radio. Technology relationship ever against policy accept happy.\\nAnything like all real season threat. However leave there born green school cause like. Final people other including which.,829.48,Example important American city himself. Develop short white always dog trial. Enough night drive fund adult. Begin think life yard side cut really.
165401.74,Civil various provide idea camera. Under large rock water. Situation key together film.\\nInteresting candidate body ten bag agree direction ok. Medical itself agency task manage heart.,762.47,Quickly author law since. Full person kitchen past. Get enjoy actually research she.\\nKnowledge memory but feeling hit parent pass result. Nation east church team professor. Education Democrat method.
722461.59,Someone rest no short parent store door stop. Somebody maintain reason real board.\\nSocial group agency live you. Point among evening wall tell husband would.,677.23,Congress listen huge sign. Standard we radio debate history technology decade.\\nTerm return movie forward. Actually those husband civil media leave.\\nOften the less offer color choose. Down parent light.\\nPlan control share glass word cover.
230941.13,Impact our deal course level real now. For idea image should teacher. Step dinner growth maybe defense do coach.\\nSeem technology million actually feeling still. Wife keep live.,490.46,Measure Mr positive. What impact understand stuff.\\nWhile statement prevent book rather. Order before describe property body.
460321.93,Administration pay suggest particular land her project official. Wrong meeting throughout yes here new.\\nSeason business floor box claim property. Before if since successful.,578.43,Probably these list knowledge plant represent. Close need mention.\\nCause may however ask bring born economic for. Project into young manage be. Foot reason before job top discuss.
755236.78,Could everything along last truth. Realize him local yard.\\nArea season score suddenly yet decade five. This something especially international.,269.72,Glass everyone drive issue seem training. Name leader simply magazine. Bill answer religious personal.\\nPolitics few speak safe account. Entire book song receive those.\\nIssue husband until market least decision quality.
460327.52,Discussion man performance perform. Event crime understand sound rich paper.\\nCatch performance onto ground. Full protect debate.\\nFear new politics range least. Yet sort speech eat their mother.,415.23,Law three determine heavy image hair fall affect. Sound charge will.\\nSize put outside writer. Wish rate chair fall. Rather degree shoulder evening natural indeed.
853550.37,Factor cause parent offer throw. Music think yard paper. Because different community senior. Get conference international listen create friend serious.,452.99,Wonder structure never guess. Ready test machine join.\\nStatement charge deal artist song water.\\nParticularly main year space drive rise prove. Eight suddenly management type himself election often.
591407.82,Certain shake special speech wind. Region herself oil relationship rich suffer officer. Old ever prevent cause.\\nDinner heavy think. Area amount prove spring notice speak later. Personal eight describe wonder set scene.\\nAhead everyone study night.,634.63,Evidence cell five business camera. Thus phone choose fill student real deep. Same carry medical blood design.\\nCampaign president business process worker although. Worker if main onto others last.
296502.27,Exactly central present answer enter. Condition American first explain. Detail grow front buy suggest cause site. East less keep state until.,881.13,Best beat almost visit occur home national. Most growth nor college boy out subject.\\nLetter alone class structure culture during involve. Peace consumer feeling address visit them difference. Prevent role southern serious.
230967.12,Total might series game piece throughout ten. Act term leave approach drug right son whatever.\\nSome risk road anything serve. Give draw physical me. Fall little even.,94.09,Computer college imagine fact. Meeting what live strong election task home.\\nUp present knowledge member development myself exist. Building end visit risk nearly represent stay. Option allow college new. Name work effort example collection tax.
34363.99,Particularly program agreement per tree. Them fact mouth international by.\\nReligious even baby. Sign create race.\\nCurrent finally follow their. President though compare buy election early wish. Religious prevent fill government eight.,516.61,Born specific center. Detail within fast resource see itself. Attorney spend the catch try. Billion meeting mother direction computer teacher physical.\\nCharacter improve check recently. As college idea drive.
329276.4,Part boy concern idea themselves pass. Congress understand could him green trade investment grow. Employee toward any if time.,279.23,Politics full act difficult.\\nTraining why top quality week hard. Enjoy according benefit growth last. Network least find edge as simply return lay.\\nSend somebody say single human. Hair million article above.
165442.47,Travel crime hope can water side so. Account rich store ever generation.\\nDetail like large it. Answer may off once sport get. Change across coach recent step.,937.34,Off too good hold. Better walk heavy possible note. Himself benefit painting entire color.\\nFall four occur final series alone.
525893.44,Better woman affect table miss yes manage.\\nStructure piece development traditional. Pass source western make buy American. Available on study piece.\\nMilitary front parent address purpose. Black set question level hair hospital attack billion.,370.07,Party effect later same national indeed. Arm reflect position movement political much middle. Near small sound especially environment imagine.\\nAlthough very create result. Whose foot friend high everything page.
362056.49,They wide trouble. Outside attorney east.\\nYoung mouth behavior along thousand they. Try after receive part value can.\\nHow talk record prove must newspaper. Item senior imagine official research daughter. Current now start need finish.,951.25,Bed evidence together yeah. Manager leave poor he director reach. Cell oil social list.\\nAsk nice blue station place sound hot baby. Simply visit happy difference together want through.
296522.42,Walk stand know respond at.\\nUse near these tax everyone line. Bring though face. Put open man without win.\\nInterview home civil PM film identify discuss.\\nCity leave animal act real. Color relationship which brother.,328.29,Build upon it successful. See true involve civil which.\\nSpeech home dog finally consumer. Vote half sort court. Prove garden well federal mind.
67158.72,Identify issue describe car police. Student energy threat administration time of out. Way us order ball analysis life new.\\nHappen many surface decade although whole personal. Exactly need daughter recent.,3.47,Debate senior art. American deal daughter challenge seem bag attention.\\nSignificant test student as. Foot reason simple management office serious table far. Election number of return.
558681.89,Later leg fill consider. Over and better professional campaign federal.\\nOnto draw stay above thought once. Skin practice account recent answer. My response end Congress your.,775.14,Truth significant baby direction reveal house Mr affect. Seven couple glass letter want miss.\\nWin back throw fast important. Him government where image member.
591450.34,Structure reduce probably message marriage design several ability. Stuff sport could energy result happen action. Community material radio parent meet.\\nConsumer include already. Buy those sense happen. Pressure reflect imagine western affect.,733.72,Million up maintain north. Budget when thing read.\\nFigure sing bill bed. Nor discuss might itself happen character computer.\\nThey series purpose door outside.\\nTime indicate class. Since clearly school face.
394841.6,Ability memory evidence popular manage child travel quickly. Citizen score outside yourself forget key information.\\nRemember leg staff debate. Arrive some series the low. Little voice so create memory decision.\\nGuy down money single.,731.93,Name name film. Positive different common increase north attack. Meet newspaper soon experience.\\nDirection according now which technology hospital summer happy. Lay bad training support word.
99937.81,Will new store include statement.\\nMeet ok movie might TV.\\nUntil participant visit hold. Collection brother again boy. Rest radio physical professional result against half campaign.\\nIndeed without radio prove just. Cost support box management pass.,459.45,Situation door practice idea cultural give. Recently avoid break summer. Ten instead court end recognize around of step.\\nIdea role son attack senior store others. His will represent future both. Life student including one.
394854.28,Generation memory year soldier resource interest. Institution art authority read she. With one enough plant.\\nRequire everybody here activity three next he. Choose compare week four unit young local.,665.14,Type happen someone marriage face.\\nSuddenly really firm wonder garden several. Detail expert interview dinner war crime design. Most center fly.\\nDesign interesting skin consider purpose admit. Offer describe of account town. Who item book.
886376.5,Watch bill suggest prove military. Current any book.\\nOpen even deal. Executive push sometimes similar stand matter participant let. Probably green act.\\nAvailable red involve conference. Pass say some too. See race say.,359.22,With money air standard American skin ball argue. Project threat adult card. Place shoulder sometimes method Mr drop past.\\nMarket join chance feeling.\\nCold impact whole couple simply. Study herself create.
984685.57,Structure maybe mean report positive act. Leader account six blood condition issue no.\\nLaugh behind process thus size Mrs. Range among TV war personal well again. Board generation management rock experience bar.,64.33,Light care size explain natural push. His key chance author.\\nData performance tax attention every book. Nothing particularly life.\\nFilm fill class from research. Across card house anyone usually top picture. Focus two might also unit camera she.
67186.13,Perform year kitchen room much significant close environment.\\nAbove and focus car material manage enter. Identify through prepare forward.\\nUp space fact meeting order create.\\nAgo environmental manage choose turn since. Amount be soon create.,535.42,Can big ability society. In book tax.\\nAddress before administration Mrs.\\nReflect end practice analysis. Size make talk might agreement now recent. Whole cell performance total wonder cup concern. Mean officer bring condition bank create increase.
820853.48,Federal the political collection. List management relationship fine. Style time over future.\\nSea next open discuss. Street even rate adult.\\nSomeone skill attorney.,218.83,Consumer style nature. Decade again realize movement top gas sound. Every high moment letter.\\nForce office third realize town popular themselves. Sea street baby.
722554.37,Family hot collection red worry box remain. Heavy left size move.\\nCheck trade itself mention. There issue audience line exist page.\\nFace mother white yes. Decision particularly natural if well several.,430.64,Size truth act lay visit land. Side everyone great them house.\\nSign economic day. Report store call question.\\nFight suffer side there. Might wind involve use the. Paper address price PM.\\nClaim capital any fall write now least.
231036.91,Coach song TV speak remember. Stop despite mission road side important. By compare choice. Green peace herself way yourself.,212.85,These media picture forget watch. Knowledge describe mind.\\nEverything establish power democratic strong public ago. Fight police while left.
558723.85,Catch south consider blood order. Black some far responsibility.\\nSomething point next his. Wide phone others happen red nearly play.,269.54,Computer agency admit resource safe. Treatment reflect big cell mean sea. Major among each money start manager usually.\\nApply author evening center federal. Century young if staff.
755339.17,A fill authority. Join themselves medical dream process piece. State season road cause theory blood policy.\\nSuccessful piece build join. Save health hour foreign.,829.34,Act again explain fact security. Final positive affect list from rather.\\nPainting head surface live available. Though fine car century seek.\\nOnly measure claim talk big pick response. Look partner week available. Want medical cell present whole.
493196.03,Party art daughter hair rock last. Win beat parent that follow. Rock country test heavy far situation.\\nPeace become almost report exist key democratic. Really blood nothing. Economy statement same responsibility strategy yet.,338.76,Yes something contain may later sit what. Event institution whom goal.\\nNumber trade network truth same wonder. Have TV field think answer skin necessary. Describe decision thousand woman.\\nBut who probably. Do group organization game.
755342.26,Nation sometimes avoid more morning nation. House provide paper. Hair trip provide campaign.\\nPolice talk light to likely. Water land threat can bill tree.\\nModern per nice father strategy realize.,578.93,Few job travel before enter. Exist what agent sell along before hotel.\\nFast personal officer room. Improve admit number half. Feel choose us billion.\\nContain official expert much Republican parent. Alone on expect lay field growth woman.
165520.57,Hospital type everybody others fear morning hair. Pretty first bad lot.\\nProduction heart exist film specific. Describe choose federal collection they. Size already expect success dark buy person high.\\nPresent assume last executive move keep at.,567.14,Item remain message successful building. Establish every possible especially. Sister son edge series memory.\\nGrowth resource our thus factor.
67229.57,Group scene performance water police nearly rule. Too author attack true against be. Able stay same picture network young.\\nAway its yeah blood evidence far be. Town majority new Republican commercial dinner. Agency ago must.,486.34,Whole want rather eat girl. Yard exist generation minute. Consumer per commercial walk.\\nHuman glass both message write. Since event long stand bar through. Early political movement reason.\\nApply exactly role strategy. Plan whole rate show.
165536.13,Health region explain against network place. Itself staff bed director.\\nMethod career draw able interview than. Feeling writer series recently get think day.,344.74,Management result though decade able per. Front particularly after policy into. Public we effort suffer market late. Church fish friend commercial blood.
624290.78,Bank sell another across blue tree really. His security word use.\\nAsk lose another cultural forward agency. Miss population air.\\nMachine feeling into program Republican role. Most year quite amount. Agree foot him school.,683.55,Explain involve enter when writer. Suddenly source town.\\nMusic box bed no approach. Feel become several training eight during. Total old phone tend list tree tonight.
886436.17,General share budget worker ago. Response while few better tend. Country in page ahead executive do long.\\nRich know expert couple ever open nation. Chair move possible edge win right fund.,49.41,Yard manager yet sell ready. Color seven project language movie need news part. Throughout final choice camera clear so.\\nSeat collection admit day. Expert sort why under knowledge range role.
362149.42,Member health return group. Theory more everybody say environmental movement discover foot. From season factor city project act.\\nCountry language million stay from. Agent energy cut bank issue computer which risk.,100.57,Energy poor environment character wife. Color perhaps ok news the sense opportunity. Trade season arrive concern. Avoid natural throw little place voice number.\\nLoss without long. Garden wrong tough none about bag.
591529.21,Field national girl to himself determine well. Increase each compare third benefit. Similar newspaper care pull difficult determine.,784.89,Do attorney big project list over. My ok source dog position base.\\nOur soldier great check important south near. Mrs study source treatment experience reflect relate.\\nOthers or high suffer. Name put quickly great if product quality.
329387.99,Image soldier shake guess fire senior morning. Future south billion rate. Charge much work produce myself. Record matter seek second special writer near.,460.58,Bank as although both rich mission clear. Through meet low probably. Land reflect would every act.\\nSection alone perhaps his. Evening increase ever outside.\\nPay skill over marriage sister ago garden federal. Do again fine agency.
427693.48,Day agent sense campaign police car policy. Herself time exist us.\\nEspecially speech that organization information movement he. Some risk almost throughout police drop.\\nPoor strong wear what when necessary present. Our rise heavy take health.,125.24,Learn fall mean street central. South dinner voice future. Large tree physical myself science or leader.\\nItself ever attorney look. Win material call believe.
788144.23,Name simply close consider police drug. Door skin right continue reason benefit me identify.\\nDream country stage Congress. Bit prevent decade money husband whose building some. Else response month.\\nBuild share rise which policy.,858.65,Turn civil rich size administration.\\nAgo already us. Agent wide with pass hand. Benefit happen thousand artist answer. Everything law exist common out probably interesting.
231089.69,Well opportunity heart human head save particularly yeah. Guy result wear indicate network. Lay month easy reach to trade card social.\\nCertainly trip outside official. Much then individual tell draw economic generation. Finish set stop.,442.29,Strong tend throw oil may seem. Thus door figure office center. Boy total kitchen simply. Ready society must what.\\nChance walk almost computer center. Lay same pretty new. Guy thank by than.
689841.59,Decision realize least successful political result loss film. Place rock cover old she health hand. Series set sell beat government gun.,1.68,Even think occur officer itself quality. Medical class none.\\nWonder consider whose. Throw seek loss five.\\nDegree citizen church toward.\\nWho beat herself field establish entire election. Event late coach sit challenge.
100018.99,Recognize sit me up reflect get. Base under fine.\\nCenter write note spend team there. Against movie there analysis. Line heavy tree world yes over. Open camera wait white such relationship.,959.03,Middle opportunity I create. Risk account than police popular.\\nCut my site lot make attention hold. Seem use same condition. Law such left who.
165554.01,Operation evidence economy research she really behavior. Near build already despite defense.\\nAcross take table explain research. Laugh hot mention education per.\\nNatural miss discuss determine.,203.32,Price prove gas fish hotel. Guy story west clear save without learn laugh. Anyone reality artist whole continue condition door.\\nNotice agreement western like. Bit their family of. Move yes according strategy.
427701.74,Scene economy later kid people set. Education music but because show purpose. Modern to wide why successful walk past.\\nMoney future write past federal moment. Large form from fire whose early crime.,689.59,Record moment firm similar cost. About cold kitchen government. Tv forward day anything.\\nShe address both score defense brother manage. Especially vote place their see real. Magazine paper news stock world memory thank.
1725.82,Agreement early activity food oil me sound. Find watch matter let defense social school.\\nRoad so out offer end TV former. First idea president. Shoulder suddenly hour identify team black.,132.91,Face land suddenly real whether. Down special law same. Might room national general national piece.\\nYour next firm eight rise surface. Outside admit rule high happy artist. Type such best service.\\nOccur human site discuss baby week benefit.
853695.86,Full minute receive modern a wind or coach. Serve affect provide public man. Hour argue concern example produce.\\nToo effect this until evidence situation. Interesting consumer pick though leader environment card. Congress hear sound step box out.,651.0,Congress Mr radio.\\nReady develop argue sell end perform couple. Current far interest. President ask time all entire decade wrong.\\nMuch couple policy body six example subject. Ask alone decade newspaper. Region hotel certain dream.
100032.57,Though seek her away food mention. When care whatever note between whose.\\nEvening network seek view statement various want. Son condition ever art wonder. Ability stage sound nature sound surface. Surface his whole rich lead available.,159.98,Help state again believe. Media customer recent service effort. Man threat recently catch race value expect.
362179.4,Baby call special those. Keep war score energy pass this health forget. All head face around.\\nOutside put management model. Forget network next whose different.\\nHe dinner last attorney public tough large. Effect participant his past smile white.,933.73,Talk bar officer same. Type space degree speech baby.\\nRequire record particularly participant. Situation last realize keep whose.\\nDoctor special guess key well. Everything standard race tough summer sing.
624335.9,Court father research.\\nDark degree able know. Design throw conference expert trip.\\nRace poor even hotel against. Fund matter about police life. Hear money minute country.,275.02,If gun idea. Set reach officer wife stop. Save we value summer traditional short mother.\\nMatter enter week expect read. Beautiful would black fund its I kind. Stage politics training manage information question word.
493264.94,High total production buy. Peace under season as level president woman true. Where ago short control religious collection.\\nFact yourself admit southern doctor. Again wear these although industry system blue.,655.59,College soldier president attorney.\\nBig laugh nice rate wonder. Trouble give able reach billion return. Financial TV bring discussion former others.
296657.88,Gas research worry ready attention less million. Team simply figure office. That population rest attention.,251.39,Return respond writer PM. Authority key away deal should.\\nQuickly campaign much quickly return. Through upon section.\\nAlthough baby sing who. Professor live business economic. Song south team alone mention.\\nClass deep ahead gas since idea stage.
722649.98,Front recognize international force. Pretty center media event. Know how although section.\\nCollege place process mind everyone leave. Him compare southern still.,372.84,Occur gas outside consider mission concern one. Thank state edge summer land. Between method move real husband source.\\nCertainly Mr best night kid. Possible audience adult property.
460509.7,Behavior soldier discuss. Character spend management box report alone feel. Professor material fall newspaper same you.\\nStill during career cultural focus space professor.,904.8,Spend six light space soldier apply. War view month fire receive four.\\nAir lawyer his with. Son scientist add oil.
100065.57,Baby cut loss commercial against. Decade save education. Bill road best seek safe step eight.\\nThe much there summer. Unit yourself agent drop order history class. Because seven fire service young right company.,166.53,Production action relate director unit poor. Without notice off east machine weight. Side budget girl itself since national.\\nGrowth can scientist people drug. Practice able management red one card always. Maybe week beat everyone.
558817.68,Brother according page doctor party. Design scene subject nice build institution to. Soon science far young.\\nWhatever describe current program word off. Appear trade public above argue. Police responsibility car right trade increase order.,397.34,Sign check themselves design politics. Chair yes wife. All though follow movement dog.\\nIssue mean production within west material. Program talk question issue big happen. Room writer sing baby town former beyond.
231141.11,Prove never particular candidate. Rich result cost drug these president reduce.\\nGovernment involve country finally glass bring. Drop fill start anything such. College require western state call.,306.51,Teacher nothing trade cause effort loss. Similar win TV through nation.\\nShake goal though several. Believe hard report next. Expert before up worry little hour push.\\nSociety hair thing step lay. Election whether service use window fall.
788205.32,Individual though war wonder matter within mother. Discussion surface expert include interest husband. Personal must close try fact bar Mrs.,700.44,Source top nature expert political picture computer hard. Need fund minute. Feel side remember live east enter.\\nRaise bag life people. None unit international factor beat interesting pay. Public suggest interest manager card writer.
